film_title,customers
HEAVENLY GUN,"CLARA SHAW, DAVE GARDINER, ERNEST STEPP, GABRIEL HARDER, JERRY JORDON, RONNIE RICKETTS, TODD TAN"
HEAVYWEIGHTS BEAST,"BERNICE WILLIS, BESSIE MORRISON, BRETT CORNWELL, BRYAN HARDISON, CHRIS BROTHERS, CHRISTY VARGAS, FRANCIS SIKES, GINA WILLIAMSON, JESSICA HALL, JOHN FARNSWORTH, KARL SEAL, KATHRYN COLEMAN, KELLY TORRES, LEONARD SCHOFIELD, LORRAINE STEPHENS, LYDIA BURKE, NAOMI JENNINGS, RUTH MARTINEZ, SALVADOR TEEL, TOMMY COLLAZO, TYRONE ASHER, VICTOR BARKLEY, WADE DELVALLE"
HEDWIG ALTER,"EDITH MCDONALD, ELLA OLIVER, GARY COY, IRMA PEARSON, KATHLEEN ADAMS, MICHAEL SILVERMAN, RANDALL NEUMANN, RICKY SHELBY, SALLY PIERCE, SAM MCDUFFIE, VIOLA HANSON, YOLANDA WEAVER"
HELLFIGHTERS SIERRA,"ANGELA HERNANDEZ, ARNOLD HAVENS, BRENDA WRIGHT, CHAD CARBONE, COURTNEY DAY, ELEANOR HUNT, ELLA OLIVER, FRED WHEAT, JEFFERY PINSON, JENNY CASTRO, JERRY JORDON, MILDRED BAILEY, ROBERT BAUGHMAN, ROLAND SOUTH, RONNIE RICKETTS, SHERRY MARSHALL, STEVEN CURLEY, TOMMY COLLAZO, VIRGIL WOFFORD, WENDY HARRISON"
HIGH ENCINO,"ANA BRADLEY, BRIAN WYMAN, BRYAN HARDISON, CARLA GUTIERREZ, EMILY DIAZ, GABRIEL HARDER, GEORGIA JACOBS, HAZEL WARREN, HENRY BILLINGSLEY, JANE BENNETT, JOSE ANDREW, KARL SEAL, LAURIE LAWRENCE, LEONARD SCHOFIELD, MAXINE SILVA, MICHEAL FORMAN, MITCHELL WESTMORELAND, NATHAN RUNYON, ROSS GREY, SUSAN WILSON, THERESA WATSON, WESLEY BULL"
HIGHBALL POTTER,"ALEXANDER FENNELL, ANNE POWELL, DAISY BATES, DARLENE ROSE, DIANE COLLINS, ERNEST STEPP, FELIX GAFFNEY, IDA ANDREWS, JAMES GANNON, JORGE OLIVARES, JULIO NOLAND, KYLE SPURLOCK, LORETTA CARPENTER, MARTIN BALES, MAURICE CRAWLEY, MAX PITT, SONIA GREGORY, STEVE MACKENZIE, TAMMY SANDERS, TIFFANY JORDAN, ZACHARY HITE"
HILLS NEIGHBORS,"ALFREDO MCADAMS, ALICE STEWART, AMBER DIXON, ARLENE HARVEY, BARRY LOVELACE, BONNIE HUGHES, CAROL GARCIA, DARLENE ROSE, HILDA HOPKINS, JOHN FARNSWORTH, JOSE ANDREW, JOY GEORGE, MARSHALL THORN, MELISSA KING, ROBERTA HARPER, RONALD WEINER, RUBEN GEARY, SERGIO STANFIELD, SETH HANNON, SHANNON FREEMAN, THEODORE CULP, TOMMY COLLAZO, TYRONE ASHER, VANESSA SIMS, YOLANDA WEAVER"
HOBBIT ALIEN,"ALVIN DELOACH, BERNARD COLBY, BESSIE MORRISON, BRIAN WYMAN, CARLA GUTIERREZ, CATHERINE CAMPBELL, CHRISTOPHER GRECO, CLARENCE GAMEZ, CRYSTAL FORD, DANIELLE DANIELS, DORA MEDINA, EDDIE TOMLIN, EDUARDO HIATT, ELSIE KELLEY, GLENDA FRAZIER, HAROLD MARTINO, IRENE PRICE, JENNIFER DAVIS, JOSE ANDREW, KELLY KNOTT, MAE FLETCHER, MARLENE WELCH, MISTY LAMBERT, RAFAEL ABNEY, RENE MCALISTER, RITA GRAHAM, ROGER QUINTANILLA, ROSE HOWARD, SHERRY MARSHALL, TYLER WREN, WILLIE MARKHAM"
HOLES BRANNIGAN,"CATHY SPENCER, CHRISTINA RAMIREZ, DAVE GARDINER, GINA WILLIAMSON, GRACE ELLIS, IRMA PEARSON, LUIS YANEZ, MAE FLETCHER, MARION SNYDER, MINNIE ROMERO, PHILLIP HOLM, SEAN DOUGLASS, SHARON ROBINSON, STEPHANIE MITCHELL, TYLER WREN"
HOLIDAY GAMES,"ALEX GRESHAM, ANDY VANHORN, CHARLENE ALVAREZ, DERRICK BOURQUE, FRED WHEAT, FREDDIE DUGGAN, HILDA HOPKINS, JAVIER ELROD, LEWIS LYMAN, MARGIE WADE, MARION OCAMPO, MORRIS MCCARTER, PATRICIA JOHNSON, RHONDA KENNEDY, SUSAN WILSON"
HOLLOW JEOPARDY,"ALAN KAHN, DERRICK BOURQUE, ELEANOR HUNT, EMILY DIAZ, JACQUELINE LONG, MARC OUTLAW, MARVIN YEE, MAURICE CRAWLEY, RONNIE RICKETTS, TRACY COLE"
HOLLYWOOD ANONYMOUS,"ADAM GOOCH, ADRIAN CLARY, ALLEN BUTTERFIELD, HAZEL WARREN, JEFF EAST, LANCE PEMBERTON, MARSHA DOUGLAS, MICHELE GRANT, SHERRI RHODES, SUE PETERS, VALERIE BLACK, WILLARD LUMPKIN, ZACHARY HITE"
HOLOCAUST HIGHBALL,"ALAN KAHN, ARNOLD HAVENS, BRETT CORNWELL, ELAINE STEVENS, GREGORY MAULDIN, JAMIE WAUGH, JORGE OLIVARES, MARCIA DEAN, MARIA MILLER, MARION SNYDER, MARVIN YEE, RONALD WEINER, SAMANTHA DUNCAN, TAMMY SANDERS, TOM MILNER, VICKIE BREWER, WAYNE TRUONG"
HOLY TADPOLE,"ARNOLD HAVENS, BERNARD COLBY, BOBBY BOUDREAU, JOANNE ROBERTSON, MORRIS MCCARTER, PENNY NEAL, RANDY GAITHER, TANYA GILBERT, WAYNE TRUONG"
HOME PITY,"ALBERT CROUSE, BRUCE SCHWARZ, DARLENE ROSE, DWAYNE OLVERA, JACOB LANCE, JEROME KENYON, MITCHELL WESTMORELAND, ROBERT BAUGHMAN, SCOTT SHELLEY, TED BREAUX, TERESA ROGERS, THERESA WATSON, TONY CARRANZA, VICKI FIELDS"
HOMEWARD CIDER,"AMANDA CARTER, ANNE POWELL, BYRON BOX, DWAYNE OLVERA, EARL SHANKS, ELMER NOE, ESTHER CRAWFORD, ETHEL WEBB, FELICIA SUTTON, IAN STILL, JUDITH COX, RENEE LANE, RUBEN GEARY, VICKIE BREWER, VICTOR BARKLEY, WILLIE HOWELL"
HOMICIDE PEACH,"CAROLE BARNETT, CHARLENE ALVAREZ, CHRISTIAN JUNG, CLAYTON BARBEE, CURTIS IRBY, DAISY BATES, DARLENE ROSE, ELLEN SIMPSON, ERIN DUNN, HELEN HARRIS, HENRY BILLINGSLEY, JAMES GANNON, LAURIE LAWRENCE, MARTHA GONZALEZ, MELINDA FERNANDEZ, MELISSA KING, MIKE WAY, NELSON CHRISTENSON, NORMAN CURRIER, PATRICK NEWSOM, SARA PERRY, TOMMY COLLAZO"
HONEY TIES,"ANNETTE OLSON, ARMANDO GRUBER, CHARLIE BESS, DARYL LARUE, ETHEL WEBB, JAIME NETTLES, JAMES GANNON, JEFFREY SPEAR, KATHY JAMES, KELLY TORRES, KENNETH GOODEN, MICHEAL FORMAN, OLGA JIMENEZ, RALPH MADRIGAL, RAMON CHOATE, RAMONA HALE, RHONDA KENNEDY, RONNIE RICKETTS, VIOLET RODRIQUEZ"
HOOK CHARIOTS,"ALMA AUSTIN, CATHERINE CAMPBELL, DWIGHT LOMBARDI, HARRY ARCE, IRENE PRICE, JULIA FLORES, KATHRYN COLEMAN, KATHY JAMES, LEROY BUSTAMANTE, MIGUEL BETANCOURT, RAUL FORTIER, TERESA ROGERS, VIRGIL WOFFORD"
HOOSIERS BIRDCAGE,"BARBARA JONES, BRYAN HARDISON, CAROLINE BOWMAN, CONSTANCE REID, ERICA MATTHEWS, JESSIE BANKS, MARSHA DOUGLAS, STACY CUNNINGHAM"
HOPE TOOTSIE,"ANNA HILL, BILLY POULIN, CARMEN OWENS, CAROL GARCIA, CAROLYN PEREZ, CARRIE PORTER, CONNIE WALLACE, DARRELL POWER, EDNA WEST, HAZEL WARREN, JORDAN ARCHULETA, KATIE ELLIOTT, LORI WOOD, OSCAR AQUINO, SUSAN WILSON, VANESSA SIMS, VERA MCCOY, VIOLA HANSON"
HORN WORKING,"BESSIE MORRISON, BETTY WHITE, BILLY POULIN, BRANDY GRAVES, BRENDA WRIGHT, DEREK BLAKELY, DUSTIN GILLETTE, EDDIE TOMLIN, EDITH MCDONALD, ERIK GUILLEN, JESSIE BANKS, JUDITH COX, JUNE CARROLL, KIMBERLY LEE, LESLIE SEWARD, LINDA WILLIAMS, MARTIN BALES, NORMAN CURRIER, REGINA BERRY, RENE MCALISTER, RUSSELL BRINSON, SAM MCDUFFIE, VIOLA HANSON, WALTER PERRYMAN"
HORROR REIGN,"ALVIN DELOACH, APRIL BURNS, BRETT CORNWELL, CLARENCE GAMEZ, DAN PAINE, DIANE COLLINS, EDNA WEST, FLORENCE WOODS, FREDDIE DUGGAN, GAIL KNIGHT, HILDA HOPKINS, JAMIE RICE, JASON MORRISSEY, JEAN BELL, JORGE OLIVARES, LLOYD DOWD, LORI WOOD, MARK RINEHART, MIRIAM MCKINNEY, PETER MENARD, RHONDA KENNEDY, TARA RYAN, TODD TAN, TONI HOLT, TROY QUIGLEY, VANESSA SIMS"
HOTEL HAPPINESS,"ALLISON STANLEY, ERIK GUILLEN, HELEN HARRIS, JOE GILLILAND, JULIAN VEST, KENNETH GOODEN, PEDRO CHESTNUT, TAMARA NGUYEN, THEODORE CULP"
HOURS RAGE,"ANDREW PURDY, ASHLEY RICHARDSON, BEVERLY BROOKS, BRUCE SCHWARZ, CARL ARTIS, CRAIG MORRELL, DEBRA NELSON, GENE SANBORN, HAZEL WARREN, JESSIE MILAM, JOHN FARNSWORTH, KRISTIN JOHNSTON, KYLE SPURLOCK, LAURA RODRIGUEZ, LEONARD SCHOFIELD, LYNN PAYNE, MORRIS MCCARTER, PAMELA BAKER, THERESA WATSON"
HOUSE DYNAMITE,"ANDREW PURDY, AUSTIN CINTRON, BESSIE MORRISON, CAROLE BARNETT, CHARLIE BESS, CODY NOLEN, DAVE GARDINER, GINA WILLIAMSON, GREG ROBINS, JIM REA, JIMMIE EGGLESTON, JOYCE EDWARDS, JUAN FRALEY, KELLY KNOTT, KRISTIN JOHNSTON, LESLIE GORDON, MARCUS HIDALGO, MAXINE SILVA, MELVIN ELLINGTON, PAULA BRYANT, ROBIN HAYES, TOM MILNER"
HUMAN GRAFFITI,"ARNOLD HAVENS, ARTHUR SIMPKINS, BRANDY GRAVES, BYRON BOX, CAROLE BARNETT, COLLEEN BURTON, DARYL LARUE, FRANKLIN TROUTMAN, GENE SANBORN, JEAN BELL, JEREMY HURTADO, KATHY JAMES, KIM CRUZ, LISA ANDERSON, RAMONA HALE"
HUNCHBACK IMPOSSIBLE,"ANGELA HERNANDEZ, BILLIE HORTON, BRENDA WRIGHT, CASEY MENA, DARREN WINDHAM, DELORES HANSEN, DIANE COLLINS, GABRIEL HARDER, GLADYS HAMILTON, GLENDA FRAZIER, HARRY ARCE, JULIA FLORES, KAY CALDWELL, KURT EMMONS, NAOMI JENNINGS, NINA SOTO, SIDNEY BURLESON, STANLEY SCROGGINS, TANYA GILBERT, TOM MILNER"
HUNGER ROOF,"AMANDA CARTER, BILLIE HORTON, BRENDA WRIGHT, GREG ROBINS, GREGORY MAULDIN, JIM REA, LEROY BUSTAMANTE, MARIAN MENDOZA, NORMA GONZALES, REGINA BERRY, RUSSELL BRINSON, STEPHEN QUALLS"
HUNTER ALTER,"MARK RINEHART, SHERRY MARSHALL, TERRI VASQUEZ, VIRGINIA GREEN"
HUNTING MUSKETEERS,"ARMANDO GRUBER, BOBBIE CRAIG, CATHERINE CAMPBELL, CHRIS BROTHERS, ERICA MATTHEWS, FRED WHEAT, HERMAN DEVORE, JACK FOUST, JEANNE LAWSON, JULIO NOLAND, KELLY TORRES, MAURICE CRAWLEY, MITCHELL WESTMORELAND, SEAN DOUGLASS, WILLIE HOWELL"
HURRICANE AFFAIR,"AMANDA CARTER, AUSTIN CINTRON, CHRISTY VARGAS, DENISE KELLY, EDDIE TOMLIN, ERIKA PENA, HILDA HOPKINS, JANICE WARD, JESSE SCHILLING, JESUS MCCARTNEY, JUDITH COX, LAURA RODRIGUEZ, LEO EBERT, LEWIS LYMAN, MARILYN ROSS, MATHEW BOLIN, MEGAN PALMER, REBECCA SCOTT, SALLY PIERCE, SAMUEL MARLOW, SHARON ROBINSON, SUE PETERS, TAMMY SANDERS, WESLEY BULL"
HUSTLER PARTY,"ASHLEY RICHARDSON, BRITTANY RILEY, CLAYTON BARBEE, COREY HAUSER, COURTNEY DAY, CURTIS IRBY, DEBBIE REYES, DIANNE SHELTON, DUANE TUBBS, EVA RAMOS, GERTRUDE CASTILLO, HOLLY FOX, JOSEPHINE GOMEZ, KIM CRUZ, MIGUEL BETANCOURT, MIKE WAY, RHONDA KENNEDY, SHIRLEY ALLEN, TERRI VASQUEZ, TROY QUIGLEY, VIOLA HANSON, VIOLET RODRIQUEZ"
HYDE DOCTOR,"ALEXANDER FENNELL, AUDREY RAY, CAROL GARCIA, CLAYTON BARBEE, EDNA WEST, FRANCIS SIKES, GAIL KNIGHT, GEORGIA JACOBS, GERTRUDE CASTILLO, GRACE ELLIS, JULIAN VEST, LILLIE KIM, LYNN PAYNE, MARGARET MOORE, MIKE WAY, NAOMI JENNINGS, NEIL RENNER, NICOLE PETERSON, PETER MENARD, ROSEMARY SCHMIDT, SANDRA MARTIN, SHARON ROBINSON, TARA RYAN, VICKIE BREWER, WENDY HARRISON"
HYSTERICAL GRAIL,"ALEX GRESHAM, ALVIN DELOACH, BRETT CORNWELL, DENNIS GILMAN, EDGAR RHOADS, FELICIA SUTTON, HUGH WALDROP, JACOB LANCE, JANET PHILLIPS, JEAN BELL, LYDIA BURKE, PATRICIA JOHNSON, RONALD WEINER, SALLY PIERCE, STACY CUNNINGHAM"
ICE CROSSING,"AGNES BISHOP, ARTHUR SIMPKINS, CYNTHIA YOUNG, DENNIS GILMAN, DUANE TUBBS, ELLA OLIVER, ERIC ROBERT, FLORENCE WOODS, GEORGIA JACOBS, JACK FOUST, JESUS MCCARTNEY, JIM REA, LINDA WILLIAMS, MIKE WAY, MINNIE ROMERO, PAMELA BAKER, PATRICIA JOHNSON, RAMON CHOATE, SAMUEL MARLOW, STELLA MORENO, TOM MILNER, TONY CARRANZA, VALERIE BLACK, WESLEY BULL"
IDAHO LOVE,"ANITA MORALES, BARBARA JONES, BILL GAVIN, CHRISTIAN JUNG, CLYDE TOBIAS, DEREK BLAKELY, GWENDOLYN MAY, JEFFREY SPEAR, JULIO NOLAND, KENNETH GOODEN, LESLIE SEWARD, LORI WOOD, MARCUS HIDALGO, NAOMI JENNINGS, NATHAN RUNYON, TODD TAN, VICKI FIELDS"
IDENTITY LOVER,"BILL GAVIN, CASEY MENA, CHRISTY VARGAS, HAROLD MARTINO, JEFFERY PINSON, KAREN JACKSON, MAUREEN LITTLE, MIRIAM MCKINNEY, PHILLIP HOLM, ROSE HOWARD, STACEY MONTGOMERY, STEPHANIE MITCHELL, VICKIE BREWER"
IDOLS SNATCHERS,"AGNES BISHOP, ALMA AUSTIN, BERTHA FERGUSON, BESSIE MORRISON, BETTY WHITE, BOBBIE CRAIG, CHRISTOPHER GRECO, CLAUDIA FULLER, CLIFFORD BOWENS, DARLENE ROSE, DELORES HANSEN, DIANNE SHELTON, DOUGLAS GRAF, ERIC ROBERT, ERIKA PENA, ERNEST STEPP, GEORGIA JACOBS, JACOB LANCE, JENNIE TERRY, JESSIE BANKS, JIM REA, LEAH CURTIS, LENA JENSEN, LORRAINE STEPHENS, MIKE WAY, RAMON CHOATE, RONALD WEINER, RUTH MARTINEZ, TARA RYAN, THEODORE CULP"
IGBY MAKER,"AGNES BISHOP, CLARENCE GAMEZ, CONNIE WALLACE, DIANE COLLINS, DUANE TUBBS, FELICIA SUTTON, GERTRUDE CASTILLO, GLORIA COOK, IVAN CROMWELL, JORGE OLIVARES, KENNETH GOODEN, LEE HAWKS, MICHELLE CLARK, PATRICK NEWSOM, RALPH MADRIGAL, RICKY SHELBY, SALLY PIERCE, STANLEY SCROGGINS, TANYA GILBERT"
ILLUSION AMELIE,"BEATRICE ARNOLD, CAROLINE BOWMAN, GRACE ELLIS, HOLLY FOX, JEAN BELL, JENNIFER DAVIS, MARJORIE TUCKER, MARSHA DOUGLAS, MELINDA FERNANDEZ, NELSON CHRISTENSON, ROSE HOWARD, TAMMY SANDERS, TERRY GRISSOM, VALERIE BLACK, VERA MCCOY"
IMAGE PRINCESS,"CORY MEEHAN, DAN PAINE, DEAN SAUER, DOUGLAS GRAF, EDUARDO HIATT, HAROLD MARTINO, MILDRED BAILEY, MYRTLE FLEMING, ROBERT BAUGHMAN, STACEY MONTGOMERY, STEPHANIE MITCHELL, TONYA CHAPMAN, TRACY HERRMANN, WILLARD LUMPKIN"
IMPACT ALADDIN,"GEORGIA JACOBS, JAIME NETTLES, JEREMY HURTADO, JOSEPHINE GOMEZ, KATHERINE RIVERA, KRISTIN JOHNSTON, MARCUS HIDALGO, RAUL FORTIER, TERRENCE GUNDERSON"
IMPOSSIBLE PREJUDICE,"BILLY POULIN, CAROLE BARNETT, CAROLINE BOWMAN, DOLORES WAGNER, DWAYNE OLVERA, GERALD FULTZ, HOLLY FOX, JOSEPH JOY, JUDITH COX, RENEE LANE, RHONDA KENNEDY, SARA PERRY, THERESA WATSON, WALTER PERRYMAN"
INCH JET,"ANGELA HERNANDEZ, BOBBY BOUDREAU, BRETT CORNWELL, DWAYNE OLVERA, IAN STILL, JAVIER ELROD, KARL SEAL, KENT ARSENAULT, LORI WOOD, LUCILLE HOLMES, MAXINE SILVA, NORA HERRERA, NORMA GONZALES, PATSY DAVIDSON, TERRY CARLSON, TIM CARY, VICKI FIELDS, WILLIE HOWELL"
INDEPENDENCE HOTEL,"BENJAMIN VARNEY, BETTY WHITE, BEVERLY BROOKS, CHARLENE ALVAREZ, CLIFTON MALCOLM, DARLENE ROSE, ELMER NOE, FREDDIE DUGGAN, HERBERT KRUGER, IRENE PRICE, JULIA FLORES, LARRY THRASHER, LOIS BUTLER, LUCY WHEELER, MARILYN ROSS, MARSHA DOUGLAS, PEDRO CHESTNUT, SHEILA WELLS, VICTOR BARKLEY"
INDIAN LOVE,"BEN EASTER, CARRIE PORTER, CHRISTIAN JUNG, DELORES HANSEN, DONNA THOMPSON, ERICA MATTHEWS, ERIK GUILLEN, FERNANDO CHURCHILL, FLORENCE WOODS, HOLLY FOX, JAIME NETTLES, JESSE SCHILLING, MARIAN MENDOZA, STEPHEN QUALLS, VINCENT RALSTON, WALTER PERRYMAN"
INFORMER DOUBLE,"ADAM GOOCH, DIANA ALEXANDER, HOLLY FOX, JEREMY HURTADO, MARGARET MOORE"
INNOCENT USUAL,"ANN EVANS, AUDREY RAY, BERNARD COLBY, BRADLEY MOTLEY, BRETT CORNWELL, CLYDE TOBIAS, DARYL LARUE, DONNA THOMPSON, ELLA OLIVER, EVERETT BANDA, HARVEY GUAJARDO, HILDA HOPKINS, JEAN BELL, JESSIE BANKS, JIMMY SCHRADER, LENA JENSEN, LEON BOSTIC, MIKE WAY, MYRTLE FLEMING, PAULA BRYANT, REGINA BERRY, ROLAND SOUTH, TIM CARY, TRACEY BARRETT, WALLACE SLONE"
INSECTS STONE,"DENNIS GILMAN, GERALDINE PERKINS, HAROLD MARTINO, JAMIE WAUGH, JARED ELY, JIMMY SCHRADER, JOANNE ROBERTSON, JUAN FRALEY, KARL SEAL, KATHY JAMES, LAWRENCE LAWTON, MONICA HICKS, NORMAN CURRIER, RAMON CHOATE, SALLY PIERCE, STANLEY SCROGGINS, TAMMY SANDERS, TROY QUIGLEY"
INSIDER ARIZONA,"BOBBY BOUDREAU, CAROLYN PEREZ, CLAYTON BARBEE, DENNIS GILMAN, EDGAR RHOADS, JESSIE MILAM, JOEL FRANCISCO, JUAN FRALEY, KATHLEEN ADAMS, KATHY JAMES, KEN PREWITT, LEON BOSTIC, MARGIE WADE, MIGUEL BETANCOURT, MONICA HICKS, RAMONA HALE, RANDY GAITHER, SALLY PIERCE, VIRGIL WOFFORD"
INSTINCT AIRPORT,"BENJAMIN VARNEY, CAROL GARCIA, CATHY SPENCER, CHAD CARBONE, CHRISTINA RAMIREZ, DORIS REED, EDNA WEST, HAZEL WARREN, JACKIE LYNCH, JEFF EAST, JOSHUA MARK, JUDY GRAY, KATIE ELLIOTT, MARCUS HIDALGO, PENNY NEAL, RENEE LANE, SETH HANNON, TIM CARY"
INTENTIONS EMPIRE,"AUDREY RAY, BILL GAVIN, CASSANDRA WALTERS, DARRELL POWER, ERIKA PENA, EVERETT BANDA, FELIX GAFFNEY, HECTOR POINDEXTER, LINDA WILLIAMS, LUCY WHEELER, MARILYN ROSS, MELANIE ARMSTRONG, MICHEAL FORMAN, SARAH LEWIS, STANLEY SCROGGINS, TIMOTHY BUNN, VIVIAN RUIZ"
INTERVIEW LIAISONS,"BEVERLY BROOKS, EARL SHANKS, ELEANOR HUNT, ELIZABETH BROWN, EVA RAMOS, HEIDI LARSON, JACKIE LYNCH, JOEL FRANCISCO, LAURIE LAWRENCE, LONNIE TIRADO, MARIA MILLER, MARILYN ROSS, MARLENE WELCH, MARSHA DOUGLAS, MARTIN BALES, REGINALD KINDER, SHARON ROBINSON, TIM CARY, VANESSA SIMS, WILLIE MARKHAM"
INTOLERABLE INTENTIONS,"AMANDA CARTER, BERTHA FERGUSON, BRITTANY RILEY, EDUARDO HIATT, ERIN DUNN, GLEN TALBERT, MARCIA DEAN, OLGA JIMENEZ, YVONNE WATKINS"
INTRIGUE WORST,"ANDRE RAPP, BARRY LOVELACE, CHESTER BENNER, DORA MEDINA, DWIGHT LOMBARDI, ERNEST STEPP, EVERETT BANDA, FELICIA SUTTON, GERALDINE PERKINS, GILBERT SLEDGE, HOLLY FOX, IAN STILL, IRENE PRICE, JAY ROBB, JEFF EAST, JIM REA, MICHEAL FORMAN, MONICA HICKS, RITA GRAHAM"
INVASION CYCLONE,"ANGELA HERNANDEZ, ANNA HILL, BEVERLY BROOKS, BILLY POULIN, CECIL VINES, CLYDE TOBIAS, DERRICK BOURQUE, DIANE COLLINS, FREDDIE DUGGAN, HECTOR POINDEXTER, JAMIE RICE, JESSIE MILAM, JULIE SANCHEZ, LAWRENCE LAWTON, LEAH CURTIS, LORETTA CARPENTER, LUCY WHEELER, MANUEL MURRELL, NATHAN RUNYON, NELSON CHRISTENSON, NICOLE PETERSON, RAYMOND MCWHORTER, RHONDA KENNEDY, ROY WHITING, SANDRA MARTIN, TARA RYAN, TRACY COLE"
IRON MOON,"DANA HART, ERIN DUNN, GWENDOLYN MAY, JAMES GANNON, JENNIE TERRY, KATHERINE RIVERA, LAURIE LAWRENCE, LENA JENSEN, RYAN SALISBURY, TIMOTHY BUNN, VIRGIL WOFFORD"
ISHTAR ROCKETEER,"EDDIE TOMLIN, ELIZABETH BROWN, GEORGIA JACOBS, JACQUELINE LONG, LESLIE GORDON, LEWIS LYMAN, MORRIS MCCARTER"
ISLAND EXORCIST,"BRANDY GRAVES, BRENDA WRIGHT, CAROLE BARNETT, CATHERINE CAMPBELL, EDDIE TOMLIN, EDNA WEST, EMMA BOYD, FRANCIS SIKES, GERALDINE PERKINS, JARED ELY, JEFFERY PINSON, JORGE OLIVARES, JOY GEORGE, KIM CRUZ, LEWIS LYMAN, MARC OUTLAW, MARION OCAMPO, MORRIS MCCARTER, NEIL RENNER, NORMA GONZALES, PATRICIA JOHNSON, ROSA REYNOLDS, TAMMY SANDERS, TANYA GILBERT, THELMA MURRAY, WALLACE SLONE"
ITALIAN AFRICAN,"ALFREDO MCADAMS, CHARLES KOWALSKI, DEBBIE REYES, JAMES GANNON, KURT EMMONS, MELINDA FERNANDEZ"
JACKET FRISCO,"ANGELA HERNANDEZ, CLIFFORD BOWENS, DEBBIE REYES, EDGAR RHOADS, ERIC ROBERT, ESTHER CRAWFORD, GREGORY MAULDIN, HOLLY FOX, JOSHUA MARK, KENT ARSENAULT, KRISTIN JOHNSTON, LEO EBERT, MELISSA KING, SARA PERRY, SUSAN WILSON, TARA RYAN, TRAVIS ESTEP, VIOLA HANSON"
JADE BUNCH,"ALVIN DELOACH, BILL GAVIN, CAROLINE BOWMAN, CORY MEEHAN, DARYL LARUE, DORIS REED, ELLA OLIVER, HELEN HARRIS, JACKIE LYNCH, JOANN GARDNER, NORMAN CURRIER, ROBERTO VU, ROBIN HAYES, ROSS GREY, SAMUEL MARLOW, STANLEY SCROGGINS, SUE PETERS, SUSAN WILSON"
JAPANESE RUN,"AMANDA CARTER, ANDREA HENDERSON, BESSIE MORRISON, DOLORES WAGNER, JUAN FRALEY, SIDNEY BURLESON"
JASON TRAP,"ANN EVANS, ARTHUR SIMPKINS, BRUCE SCHWARZ, CORY MEEHAN, CURTIS IRBY, DIANA ALEXANDER, EVA RAMOS, GABRIEL HARDER, GERTRUDE CASTILLO, HARRY ARCE, HERBERT KRUGER, JOANN GARDNER, JON WILES, KEITH RICO, KIRK STCLAIR, LENA JENSEN, MARGIE WADE, MARSHA DOUGLAS, NATHANIEL ADAM, PEDRO CHESTNUT, ROLAND SOUTH, SARA PERRY, SHIRLEY ALLEN, TAMMY SANDERS"
JAWBREAKER BROOKLYN,"DALE RATCLIFF, GERALDINE PERKINS, HENRY BILLINGSLEY, IVAN CROMWELL, JOANNE ROBERTSON, JON WILES, KEN PREWITT, MARTHA GONZALEZ, MATTIE HOFFMAN, THOMAS GRIGSBY"
JAWS HARRY,"AMY LOPEZ, ANTONIO MEEK, ARLENE HARVEY, CLARA SHAW, DIANA ALEXANDER, ELAINE STEVENS, ELSIE KELLEY, HOLLY FOX, LEON BOSTIC, MAXINE SILVA, RHONDA KENNEDY, SUE PETERS, VERNON CHAPA, VIRGINIA GREEN"
JEDI BENEATH,"BARRY LOVELACE, BRUCE SCHWARZ, CATHY SPENCER, CHARLES KOWALSKI, CURTIS IRBY, DEANNA BYRD, DONALD MAHON, GLENDA FRAZIER, HEIDI LARSON, JACKIE LYNCH, KELLY KNOTT, LORI WOOD, LUIS YANEZ, LYNN PAYNE, MICHEAL FORMAN, NEIL RENNER, REGINA BERRY, ROGER QUINTANILLA, TIM CARY"
JEEPERS WEDDING,"BRITTANY RILEY, CECIL VINES, HEATHER MORRIS, JAIME NETTLES, JULIE SANCHEZ, LEAH CURTIS, LORETTA CARPENTER, MARY SMITH, NORA HERRERA, RALPH MADRIGAL, RAMONA HALE, ROBERTA HARPER, RODNEY MOELLER, STEVEN CURLEY, TONI HOLT, TONYA CHAPMAN"
JEKYLL FROGMEN,"CHRISTOPHER GRECO, DIANNE SHELTON, ELLEN SIMPSON, GLENDA FRAZIER, GUY BROWNLEE, JAMES GANNON, JESSIE MILAM, JOANNE ROBERTSON, JUNE CARROLL, KAY CALDWELL, KEITH RICO, MAX PITT, NEIL RENNER, PATRICK NEWSOM, SHANNON FREEMAN, TOM MILNER"
JEOPARDY ENCINO,"DIANA ALEXANDER, FREDERICK ISBELL, IAN STILL, JAY ROBB, KAREN JACKSON, KATHRYN COLEMAN, LOUISE JENKINS, MARILYN ROSS, PHYLLIS FOSTER, ROY WHITING"
JERICHO MULAN,"AMBER DIXON, ARLENE HARVEY, DENISE KELLY, ETHEL WEBB, GABRIEL HARDER, GAIL KNIGHT, GARY COY, JAMIE WAUGH, JESSICA HALL, JIMMIE EGGLESTON, MARSHALL THORN, MEGAN PALMER, MILDRED BAILEY, MORRIS MCCARTER, RUTH MARTINEZ, STEPHANIE MITCHELL, TIFFANY JORDAN"
JERK PAYCHECK,"ADAM GOOCH, AGNES BISHOP, ANITA MORALES, DIANNE SHELTON, DWAYNE OLVERA, ESTHER CRAWFORD, HEATHER MORRIS, HERBERT KRUGER, JEFFERY PINSON, KURT EMMONS, LILLIE KIM, LORI WOOD, MARIAN MENDOZA, NEIL RENNER, RICHARD MCCRARY, STEPHEN QUALLS, SUE PETERS, SUZANNE NICHOLS, VERA MCCOY"
JERSEY SASSY,"CONNIE WALLACE, ERIKA PENA, JORGE OLIVARES, LORRAINE STEPHENS, MATTHEW MAHAN, TERRENCE GUNDERSON"
JET NEIGHBORS,"ALICE STEWART, ALLAN CORNISH, BEVERLY BROOKS, CHRISTINE ROBERTS, DOROTHY TAYLOR, FRANCISCO SKIDMORE, JANICE WARD, JOE GILLILAND, MARSHA DOUGLAS, MISTY LAMBERT, NAOMI JENNINGS, PENNY NEAL, SONIA GREGORY, THEODORE CULP, VELMA LUCAS, VIOLET RODRIQUEZ, WALTER PERRYMAN, WENDY HARRISON"
JINGLE SAGEBRUSH,"BRENDA WRIGHT, CHAD CARBONE, ELSIE KELLEY, EVERETT BANDA, GERALDINE PERKINS, GLENN PULLEN, JIMMY SCHRADER, KAY CALDWELL, MARTHA GONZALEZ, MARTIN BALES, PAUL TROUT, PEDRO CHESTNUT, RONNIE RICKETTS"
JOON NORTHWEST,"ALAN KAHN, ANDREA HENDERSON, ANDREW PURDY, EDUARDO HIATT, ELMER NOE, ENRIQUE FORSYTHE, EVA RAMOS, HAZEL WARREN, KRISTIN JOHNSTON, LEWIS LYMAN, MILDRED BAILEY, MONICA HICKS, NICHOLAS BARFIELD, NORMAN CURRIER, PETER MENARD, THERESA WATSON, VALERIE BLACK"
JUGGLER HARDLY,"ALBERT CROUSE, ALMA AUSTIN, ANN EVANS, BOBBY BOUDREAU, BONNIE HUGHES, CARMEN OWENS, CHRISTIAN JUNG, CINDY FISHER, DARREN WINDHAM, DEREK BLAKELY, GERTRUDE CASTILLO, IVAN CROMWELL, JEFFERY PINSON, JESSE SCHILLING, JOEL FRANCISCO, JOSHUA MARK, KIM CRUZ, KRISTEN CHAVEZ, LEONA OBRIEN, LORI WOOD, MAXINE SILVA, NATHAN RUNYON, PHILIP CAUSEY, RAFAEL ABNEY, RAMON CHOATE, SAM MCDUFFIE, TIFFANY JORDAN, TIM CARY, TRACY COLE, VELMA LUCAS, VIRGINIA GREEN"
JUMANJI BLADE,"BRADLEY MOTLEY, ELLEN SIMPSON, GERTRUDE CASTILLO, HARVEY GUAJARDO, ISAAC OGLESBY, MARY SMITH, NAOMI JENNINGS, SHERRI RHODES"
JUMPING WRATH,"CARRIE PORTER, DANNY ISOM, DEBBIE REYES, DELORES HANSEN, GEORGE LINTON, HAROLD MARTINO, HERMAN DEVORE, JOANN GARDNER, JOSE ANDREW, JULIAN VEST, KRISTIN JOHNSTON, LENA JENSEN, LLOYD DOWD, MARIA MILLER, MARTHA GONZALEZ, MATTIE HOFFMAN, MIGUEL BETANCOURT, NORA HERRERA, PATRICK NEWSOM, REGINALD KINDER, SARA PERRY, SCOTT SHELLEY, SHANNON FREEMAN, SUSAN WILSON"
JUNGLE CLOSER,"DARLENE ROSE, ERIKA PENA, JENNY CASTRO, MARIO CHEATHAM, MITCHELL WESTMORELAND, RAY HOULE, RENEE LANE, SHARON ROBINSON, WILLIAM SATTERFIELD"
KANE EXORCIST,"ALBERTO HENNING, ALLISON STANLEY, CECIL VINES, CHARLES KOWALSKI, DALE RATCLIFF, FERNANDO CHURCHILL, IAN STILL, LUCILLE HOLMES, MARGARET MOORE, MELISSA KING, MILDRED BAILEY, VIRGINIA GREEN, WALTER PERRYMAN, YVONNE WATKINS"
KARATE MOON,"ADAM GOOCH, ANA BRADLEY, APRIL BURNS, DARREN WINDHAM, DELORES HANSEN, EILEEN CARR, EMMA BOYD, GARY COY, JESUS MCCARTNEY, JIMMY SCHRADER, JUAN FRALEY, LORI WOOD, LUCY WHEELER, MABEL HOLLAND, MARILYN ROSS, MATTHEW MAHAN, NINA SOTO, RAFAEL ABNEY, RICK MATTOX, SCOTT SHELLEY, THELMA MURRAY, THERESA WATSON, WESLEY BULL"
KICK SAVANNAH,"AMBER DIXON, CARRIE PORTER, CATHY SPENCER, CHARLIE BESS, CHRISTOPHER GRECO, CYNTHIA YOUNG, DENISE KELLY, EDITH MCDONALD, JO FOWLER, JUAN FRALEY, JUDITH COX, LORRAINE STEPHENS, MARGIE WADE, MARTHA GONZALEZ, MELINDA FERNANDEZ, MICHAEL SILVERMAN, RODNEY MOELLER, SARAH LEWIS, TERRANCE ROUSH, VIRGIL WOFFORD"
KILLER INNOCENT,"BRENT HARKINS, CAROLINE BOWMAN, EDWARD BAUGH, KELLY TORRES, PATRICK NEWSOM, PERRY SWAFFORD"
KING EVOLUTION,"ALLEN BUTTERFIELD, BRAD MCCURDY, DEBBIE REYES, HAZEL WARREN, IAN STILL, JEFFERY PINSON, JOHNNIE CHISHOLM, MITCHELL WESTMORELAND, RAYMOND MCWHORTER"
KISS GLORY,"ALICIA MILLS, ANDREA HENDERSON, BETH FRANKLIN, EDNA WEST, EILEEN CARR, GERALD FULTZ, GILBERT SLEDGE, HAROLD MARTINO, JOHN FARNSWORTH, JUSTIN NGO, MARTHA GONZALEZ, MAURICE CRAWLEY, MELINDA FERNANDEZ, NATHANIEL ADAM, PAULA BRYANT, RAMON CHOATE, REGINALD KINDER, ROSEMARY SCHMIDT, ROY WHITING, WADE DELVALLE, WILMA RICHARDS"
KISSING DOLLS,"ALEX GRESHAM, BECKY MILES, CATHY SPENCER, DALE RATCLIFF, EVERETT BANDA, GERALD FULTZ, GLENDA FRAZIER, KATHRYN COLEMAN, LEWIS LYMAN, LORI WOOD, MARIO CHEATHAM, MATTHEW MAHAN, MAX PITT, MICHAEL SILVERMAN, MISTY LAMBERT, PATSY DAVIDSON, RITA GRAHAM, ROSS GREY, TAMARA NGUYEN, VIOLET RODRIQUEZ"
KNOCK WARLOCK,"ALAN KAHN, BEATRICE ARNOLD, BENJAMIN VARNEY, BILL GAVIN, BONNIE HUGHES, CAROLYN PEREZ, CHARLENE ALVAREZ, CLAUDE HERZOG, CLIFFORD BOWENS, DAVE GARDINER, FLOYD GANDY, GAIL KNIGHT, GILBERT SLEDGE, JEROME KENYON, JOSEPHINE GOMEZ, MARGARET MOORE, MARIE TURNER, MICHELLE CLARK, PHILLIP HOLM, RANDY GAITHER, ROSE HOWARD, SARAH LEWIS, VIOLA HANSON"
KRAMER CHOCOLATE,"ANTHONY SCHWAB, CALVIN MARTEL, DARREN WINDHAM, DWIGHT LOMBARDI, FLORENCE WOODS, GLEN TALBERT, HUGH WALDROP, KATHY JAMES, MANUEL MURRELL"
KWAI HOMEWARD,"ALLEN BUTTERFIELD, BILL GAVIN, CLIFFORD BOWENS, DANNY ISOM, DUANE TUBBS, ELLA OLIVER, FELICIA SUTTON, GABRIEL HARDER, GERALDINE PERKINS, GREG ROBINS, HAROLD MARTINO, HARRY ARCE, JEAN BELL, JESSE SCHILLING, JOANNE ROBERTSON, JOE GILLILAND, KEITH RICO, MEGAN PALMER, MELVIN ELLINGTON, SALLY PIERCE, SAM MCDUFFIE, TYLER WREN"
LABYRINTH LEAGUE,"CECIL VINES, CHAD CARBONE, COREY HAUSER, DOLORES WAGNER, DORIS REED, GLEN TALBERT, JULIAN VEST, KEN PREWITT, LOIS BUTLER, LORETTA CARPENTER, MARCIA DEAN, MARTIN BALES, NELLIE GARRETT, VERONICA STONE, WALTER PERRYMAN"
LADY STAGE,"ANNETTE OLSON, DOLORES WAGNER, ELEANOR HUNT, ELLEN SIMPSON, ETHEL WEBB, FELIX GAFFNEY, JENNIE TERRY, JENNY CASTRO, JO FOWLER, LONNIE TIRADO, MARIE TURNER, MIKE WAY, NINA SOTO, RUTH MARTINEZ, SAM MCDUFFIE, TERRI VASQUEZ, VICKI FIELDS"
LADYBUGS ARMAGEDDON,"ALAN KAHN, DEBRA NELSON, DEREK BLAKELY, JULIE SANCHEZ, THERESA WATSON, WESLEY BULL"
LAMBS CINCINATTI,"DEREK BLAKELY, GLEN TALBERT, JOE GILLILAND, LISA ANDERSON, MAX PITT, MAXINE SILVA, RICARDO MEADOR, SARA PERRY, TONYA CHAPMAN, WAYNE TRUONG"
LANGUAGE COWBOY,"BRAD MCCURDY, DEBBIE REYES, JEAN BELL, JENNIE TERRY, JIMMY SCHRADER, JOSEPHINE GOMEZ, LEONA OBRIEN, MARTHA GONZALEZ, MICHAEL SILVERMAN, ROSEMARY SCHMIDT, SARA PERRY"
LAWLESS VISION,"AMY LOPEZ, CYNTHIA YOUNG, DIANE COLLINS, DIANNE SHELTON, DORIS REED, ESTHER CRAWFORD, FRANCISCO SKIDMORE, GAIL KNIGHT, HEATHER MORRIS, LOUIS LEONE, MINNIE ROMERO, NATHAN RUNYON, PEDRO CHESTNUT, STEPHEN QUALLS, TODD TAN, TRACY HERRMANN, WARREN SHERROD"
LAWRENCE LOVE,"ALLEN BUTTERFIELD, CARMEN OWENS, DANIELLE DANIELS, ELIZABETH BROWN, EMILY DIAZ, JASON MORRISSEY, JOANNE ROBERTSON, KIMBERLY LEE, LEONARD SCHOFIELD, MARJORIE TUCKER, RAYMOND MCWHORTER, SHEILA WELLS, WILLIAM SATTERFIELD"
LEAGUE HELLFIGHTERS,"APRIL BURNS, ARNOLD HAVENS, ARTHUR SIMPKINS, CATHY SPENCER, DIANA ALEXANDER, HARVEY GUAJARDO, JARED ELY, JEANNE LAWSON, JEFFREY SPEAR, KATHLEEN ADAMS, MARION OCAMPO, PERRY SWAFFORD, RHONDA KENNEDY, SHANNON FREEMAN, STELLA MORENO, THEODORE CULP, WENDY HARRISON"
LEATHERNECKS DWARFS,"CHERYL MURPHY, CLIFTON MALCOLM, ENRIQUE FORSYTHE, FRANK WAGGONER, MARIE TURNER, SHAWN HEATON, YOLANDA WEAVER"
