film_title,customers
DARKNESS WAR,"BERNARD COLBY, BERNICE WILLIS, CECIL VINES, DEBORAH WALKER, EDWARD BAUGH, JANE BENNETT, JIMMY SCHRADER, LARRY THRASHER, MARIO CHEATHAM, MATTIE HOFFMAN, MILTON HOWLAND, RYAN SALISBURY, STEPHEN QUALLS"
DARKO DORADO,"CLARA SHAW, EVELYN MORGAN, JACKIE LYNCH, JACOB LANCE, JOANNE ROBERTSON, LESLIE SEWARD, LUIS YANEZ, TARA RYAN, TONYA CHAPMAN, WANDA PATTERSON, WILLIAM SATTERFIELD"
DARLING BREAKING,"EDWIN BURK, FREDDIE DUGGAN, HERMAN DEVORE, HOLLY FOX, JAMIE WAUGH, LILLIAN GRIFFIN, NICHOLAS BARFIELD, REGINA BERRY, SYLVIA ORTIZ"
DARN FORRESTER,"ANDY VANHORN, ANNETTE OLSON, BRENT HARKINS, CONNIE WALLACE, HARRY ARCE, HERBERT KRUGER, ISAAC OGLESBY, JANET PHILLIPS, JULIAN VEST, JUSTIN NGO, KATIE ELLIOTT, KRISTIN JOHNSTON, LESLIE GORDON, MAUREEN LITTLE, TAMMY SANDERS, TIM CARY, TONYA CHAPMAN, VIRGINIA GREEN"
DATE SPEED,"AMY LOPEZ, CAROLE BARNETT, CLINTON BUFORD, ELIZABETH BROWN, ERIKA PENA, FRED WHEAT, HELEN HARRIS, JOHN FARNSWORTH, JUANITA MASON, KARL SEAL, SHANNON FREEMAN, STACEY MONTGOMERY, TERRENCE GUNDERSON"
DAUGHTER MADIGAN,"ALVIN DELOACH, CARLA GUTIERREZ, EDUARDO HIATT, HELEN HARRIS, LESLIE GORDON, OLGA JIMENEZ, SUZANNE NICHOLS, TYRONE ASHER"
DAWN POND,"ALEX GRESHAM, ANGEL BARCLAY, ANNE POWELL, CHERYL MURPHY, CHRISTINE ROBERTS, DWIGHT LOMBARDI, EDNA WEST, GERTRUDE CASTILLO, GREG ROBINS, ISAAC OGLESBY, JOE GILLILAND, MARCIA DEAN, MARIE TURNER, NEIL RENNER, NELSON CHRISTENSON, PAMELA BAKER, RHONDA KENNEDY"
DAY UNFAITHFUL,"DON BONE, HARRY ARCE, JEROME KENYON, JESSIE BANKS, KAREN JACKSON, KATHY JAMES, KAY CALDWELL, MAE FLETCHER, MARLENE WELCH, MIRIAM MCKINNEY, PETER MENARD, SUSAN WILSON, TROY QUIGLEY, YOLANDA WEAVER"
DECEIVER BETRAYED,"ALICIA MILLS, ALMA AUSTIN, APRIL BURNS, BERNICE WILLIS, CYNTHIA YOUNG, DALE RATCLIFF, EVERETT BANDA, JUSTIN NGO, KAREN JACKSON, LUCY WHEELER, MICHELE GRANT, NORA HERRERA, PATRICK NEWSOM, PHYLLIS FOSTER, RENEE LANE, SHARON ROBINSON, STEPHEN QUALLS, SUZANNE NICHOLS, TERRANCE ROUSH, WARREN SHERROD, ZACHARY HITE"
DEEP CRUSADE,"ANA BRADLEY, ARNOLD HAVENS, BARBARA JONES, BESSIE MORRISON, CATHY SPENCER, DANA HART, DARRYL ASHCRAFT, DEAN SAUER, HARRY ARCE, JERRY JORDON, MARGARET MOORE, MICHELE GRANT, STELLA MORENO, THOMAS GRIGSBY"
DEER VIRGINIAN,"ANNETTE OLSON, ARMANDO GRUBER, BRANDY GRAVES, CHAD CARBONE, CLARA SHAW, DANIEL CABRAL, DARRELL POWER, DEAN SAUER, DENNIS GILMAN, EDDIE TOMLIN, EVERETT BANDA, FLORENCE WOODS, FRANK WAGGONER, HARVEY GUAJARDO, HILDA HOPKINS, HUGH WALDROP, JACQUELINE LONG, JANICE WARD, JESSE SCHILLING, JESSIE BANKS, LAURIE LAWRENCE, LEAH CURTIS, PEDRO CHESTNUT, RHONDA KENNEDY, ROGER QUINTANILLA, TODD TAN, VIVIAN RUIZ"
DESERT POSEIDON,"ALFRED CASILLAS, ANDREW PURDY, BRITTANY RILEY, EDGAR RHOADS, FREDERICK ISBELL, HILDA HOPKINS, ISAAC OGLESBY, JIM REA, JULIE SANCHEZ, KATIE ELLIOTT, KURT EMMONS, LONNIE TIRADO, LOUISE JENKINS, MICHELE GRANT, NATALIE MEYER, OLGA JIMENEZ, REBECCA SCOTT, ROSE HOWARD, TED BREAUX"
DESIRE ALIEN,"ARTHUR SIMPKINS, CHRISTY VARGAS, CLIFFORD BOWENS, GLENDA FRAZIER, HARRY ARCE, IRMA PEARSON, JEREMY HURTADO, KARL SEAL"
DESPERATE TRAINSPOTTING,"DEANNA BYRD, DEBBIE REYES, JIMMY SCHRADER, MANUEL MURRELL, MATTHEW MAHAN, TERESA ROGERS"
DESTINATION JERK,"ANNETTE OLSON, BARRY LOVELACE, EARL SHANKS, JUDITH COX, MIGUEL BETANCOURT, RODNEY MOELLER, ROSA REYNOLDS, STEPHEN QUALLS"
DESTINY SATURDAY,"ANDRE RAPP, ANGELA HERNANDEZ, ARNOLD HAVENS, BOBBY BOUDREAU, CLAYTON BARBEE, DWAYNE OLVERA, GLADYS HAMILTON, HOWARD FORTNER, KARL SEAL, RALPH MADRIGAL, REGINALD KINDER, ROSEMARY SCHMIDT, SALVADOR TEEL, SHIRLEY ALLEN, TIMOTHY BUNN, WALLACE SLONE"
DETAILS PACKER,"CLIFFORD BOWENS, DEBRA NELSON, DOROTHY TAYLOR, GLENN PULLEN, GORDON ALLARD, GRACE ELLIS, JAVIER ELROD, KENT ARSENAULT, LEROY BUSTAMANTE, MARCIA DEAN, MARSHALL THORN, MIRIAM MCKINNEY, PAUL TROUT, RONNIE RICKETTS, ROSA REYNOLDS, STACEY MONTGOMERY, STEVEN CURLEY, SUZANNE NICHOLS, VIOLET RODRIQUEZ"
DETECTIVE VISION,"AMANDA CARTER, BOBBY BOUDREAU, CHRISTIAN JUNG, DAVE GARDINER, FRANK WAGGONER, FRED WHEAT, JAY ROBB, JUANITA MASON, JUDY GRAY, JUSTIN NGO, LEE HAWKS, LEWIS LYMAN, LOIS BUTLER, MARIAN MENDOZA, MARTHA GONZALEZ, MARY SMITH, MIGUEL BETANCOURT, NELLIE GARRETT, RANDY GAITHER, ROSA REYNOLDS, SHIRLEY ALLEN, TANYA GILBERT, TERESA ROGERS, TIM CARY, WILLIE HOWELL"
DEVIL DESIRE,"ANDRE RAPP, DUANE TUBBS, ELLEN SIMPSON, GILBERT SLEDGE, JANET PHILLIPS, LEWIS LYMAN, MARIAN MENDOZA, MEGAN PALMER, MYRTLE FLEMING, PAULINE HENRY, PERRY SWAFFORD, ROBERTA HARPER, ROSE HOWARD, RYAN SALISBURY, SIDNEY BURLESON"
DIARY PANIC,"ALAN KAHN, BETTY WHITE, DARRELL POWER, ELAINE STEVENS, GRACE ELLIS, JEANNE LAWSON, MISTY LAMBERT, PAULINE HENRY, VELMA LUCAS"
DINOSAUR SECRETARY,"AMANDA CARTER, BILLIE HORTON, BOBBY BOUDREAU, CARRIE PORTER, ELEANOR HUNT, ERICA MATTHEWS, ETHEL WEBB, GLEN TALBERT, GUY BROWNLEE, HOWARD FORTNER, JAMES GANNON, JON WILES, KENT ARSENAULT, PERRY SWAFFORD, PRISCILLA LOWE, RUBEN GEARY, SARA PERRY, VIOLET RODRIQUEZ, VIRGIL WOFFORD"
DIRTY ACE,"ARMANDO GRUBER, DAVE GARDINER, DWAYNE OLVERA, DWIGHT LOMBARDI, EDDIE TOMLIN, GWENDOLYN MAY, JEROME KENYON, JOY GEORGE, LEAH CURTIS, MARSHA DOUGLAS, MATHEW BOLIN, NELSON CHRISTENSON, ROGER QUINTANILLA, STEVE MACKENZIE, VIRGIL WOFFORD"
DISCIPLE MOTHER,"ANGEL BARCLAY, BARRY LOVELACE, CAROLINE BOWMAN, CLARA SHAW, CLAYTON BARBEE, COREY HAUSER, DEBRA NELSON, JEREMY HURTADO, JOSEPHINE GOMEZ, MILTON HOWLAND, MINNIE ROMERO, NELSON CHRISTENSON, STACY CUNNINGHAM, THELMA MURRAY, VICKIE BREWER, VINCENT RALSTON, WENDY HARRISON"
DISTURBING SCARFACE,"ANGEL BARCLAY, CECIL VINES, CHARLOTTE HUNTER, CHRISTOPHER GRECO, CONSTANCE REID, DAVID ROYAL, DIANNE SHELTON, DONNA THOMPSON, FRANCIS SIKES, FRED WHEAT, GWENDOLYN MAY, HILDA HOPKINS, JEANETTE GREENE, JEFFREY SPEAR, JOANNE ROBERTSON, JON WILES, KATHRYN COLEMAN, LEONARD SCHOFIELD, LOUISE JENKINS, MARIO CHEATHAM, MAXINE SILVA, MICHELE GRANT, RENEE LANE, ROLAND SOUTH, TODD TAN, VERA MCCOY"
DIVIDE MONSTER,"AMY LOPEZ, ANGEL BARCLAY, ANGELA HERNANDEZ, BOBBIE CRAIG, BRENT HARKINS, CARLOS COUGHLIN, CHAD CARBONE, CHESTER BENNER, COREY HAUSER, DEBBIE REYES, DIANNE SHELTON, EMILY DIAZ, JORDAN ARCHULETA, JULIAN VEST, MARC OUTLAW, PAULINE HENRY, RANDALL NEUMANN, RUBEN GEARY, SHAWN HEATON, VALERIE BLACK, VICKIE BREWER"
DIVINE RESURRECTION,"ADRIAN CLARY, ALMA AUSTIN, AMBER DIXON, ARLENE HARVEY, ARTHUR SIMPKINS, DARRELL POWER, JAIME NETTLES, JAVIER ELROD, LOUIS LEONE, MANUEL MURRELL, MARCUS HIDALGO, RALPH MADRIGAL, RON DELUCA, SARAH LEWIS, VERONICA STONE"
DIVORCE SHINING,"ALEXANDER FENNELL, DENNIS GILMAN, GEORGE LINTON, JEREMY HURTADO, NATHANIEL ADAM, PENNY NEAL, RAMONA HALE"
DOCTOR GRAIL,"BRUCE SCHWARZ, CLARENCE GAMEZ, DIANNE SHELTON, JAMIE WAUGH, KELLY TORRES, LEROY BUSTAMANTE, RICKY SHELBY"
DOGMA FAMILY,"ALFREDO MCADAMS, ALICIA MILLS, ALMA AUSTIN, BARBARA JONES, BRAD MCCURDY, CALVIN MARTEL, DAN PAINE, DANIEL CABRAL, DANIELLE DANIELS, DONALD MAHON, DWAYNE OLVERA, EVA RAMOS, HAROLD MARTINO, HAZEL WARREN, JASON MORRISSEY, JOEL FRANCISCO, JOY GEORGE, JULIAN VEST, JUNE CARROLL, KATHLEEN ADAMS, LAURA RODRIGUEZ, MARIE TURNER, MARION SNYDER, MEGAN PALMER, ROSEMARY SCHMIDT, THERESA WATSON, TRACY HERRMANN, VALERIE BLACK, VERONICA STONE, YVONNE WATKINS"
DOLLS RAGE,"ALLISON STANLEY, BEATRICE ARNOLD, DWAYNE OLVERA, JEAN BELL, JIM REA, JUNE CARROLL, MARIE TURNER, MELANIE ARMSTRONG, NAOMI JENNINGS"
DONNIE ALLEY,"BETTY WHITE, CHAD CARBONE, ERIC ROBERT, ERIK GUILLEN, JESSIE MILAM, LEON BOSTIC, MABEL HOLLAND, MARJORIE TUCKER, MILTON HOWLAND, NORMAN CURRIER, SHERRY MARSHALL, TERRY GRISSOM, WALTER PERRYMAN, WILMA RICHARDS"
DOOM DANCING,"AMANDA CARTER, ANDREA HENDERSON, BRYAN HARDISON, DIANNE SHELTON, GLEN TALBERT, IRENE PRICE, JASON MORRISSEY, JEAN BELL, JULIA FLORES, KRISTINA CHAMBERS, LEONA OBRIEN, MATTIE HOFFMAN, MELISSA KING, RONALD WEINER, ROY WHITING, SHIRLEY ALLEN, TAMARA NGUYEN, TERESA ROGERS, TRACEY BARRETT, TRACY HERRMANN"
DOORS PRESIDENT,"ALAN KAHN, CASEY MENA, CATHERINE CAMPBELL, ERIC ROBERT, GUY BROWNLEE, JUDITH COX, KATHRYN COLEMAN, LEON BOSTIC, MARLENE WELCH, MARY SMITH, NATHAN RUNYON, NELLIE GARRETT, PATRICIA JOHNSON, RANDALL NEUMANN, SAMANTHA DUNCAN, SHARON ROBINSON, WANDA PATTERSON, WAYNE TRUONG, YOLANDA WEAVER"
DORADO NOTTING,"AARON SELBY, ARLENE HARVEY, BERTHA FERGUSON, CARLA GUTIERREZ, CHARLES KOWALSKI, DANIELLE DANIELS, DARLENE ROSE, DEAN SAUER, ELLA OLIVER, ELMER NOE, ERIN DUNN, GWENDOLYN MAY, HAROLD MARTINO, JEFFREY SPEAR, JOANNE ROBERTSON, JOHNNIE CHISHOLM, JOSEPH JOY, JUANITA MASON, LUIS YANEZ, LYNN PAYNE, MINNIE ROMERO, MISTY LAMBERT, ROGER QUINTANILLA, ROSE HOWARD, RUBY WASHINGTON, TINA SIMMONS, VELMA LUCAS"
DOUBLE WRATH,"ALEX GRESHAM, ANA BRADLEY, ARLENE HARVEY, ARNOLD HAVENS, CARLA GUTIERREZ, DEBBIE REYES, DUSTIN GILLETTE, ELIZABETH BROWN, EMMA BOYD, ERIKA PENA, FLOYD GANDY, HAROLD MARTINO, JACK FOUST, JASON MORRISSEY, KEVIN SCHULER, LESLIE SEWARD, LUCILLE HOLMES, MARCIA DEAN, RAFAEL ABNEY, RAYMOND MCWHORTER, RUSSELL BRINSON, TIM CARY, WESLEY BULL, YVONNE WATKINS"
DOUBTFIRE LABYRINTH,"ANGEL BARCLAY, ENRIQUE FORSYTHE, JEFF EAST, JORGE OLIVARES, KATHY JAMES, MILTON HOWLAND, RICKY SHELBY, SETH HANNON, TODD TAN, VINCENT RALSTON"
DOWNHILL ENOUGH,"BESSIE MORRISON, BILLY POULIN, BRYAN HARDISON, DARREN WINDHAM, DWIGHT LOMBARDI, EARL SHANKS, EMMA BOYD, FRANCES PARKER, GEORGIA JACOBS, JENNIE TERRY, JERRY JORDON, KAREN JACKSON, LONNIE TIRADO, MARIE TURNER, NINA SOTO, NORMA GONZALES, RENE MCALISTER, SALVADOR TEEL, SHERRI RHODES, SIDNEY BURLESON, TRACY HERRMANN, VERA MCCOY, VIOLA HANSON, WALLACE SLONE, WILLIE MARKHAM"
DOZEN LION,"BRUCE SCHWARZ, CATHERINE CAMPBELL, DANIELLE DANIELS, JAY ROBB, MARION OCAMPO, TONY CARRANZA, WILLIE MARKHAM"
DRACULA CRYSTAL,"CASSANDRA WALTERS, CLIFTON MALCOLM, DARRELL POWER, DIANA ALEXANDER, EVELYN MORGAN, FRED WHEAT, HOWARD FORTNER, JIM REA, KURT EMMONS, LORETTA CARPENTER, LOUISE JENKINS, MICHELLE CLARK, NANCY THOMAS, REGINALD KINDER, SIDNEY BURLESON, TYRONE ASHER, VICKI FIELDS, VICTOR BARKLEY, VIOLA HANSON, VIOLET RODRIQUEZ, WENDY HARRISON"
DRAGON SQUAD,"EDGAR RHOADS, FRANCISCO SKIDMORE, JOANN GARDNER, JORDAN ARCHULETA, JOSE ANDREW, KYLE SPURLOCK, MICHELLE CLARK, RUSSELL BRINSON, TANYA GILBERT, VICKIE BREWER, WAYNE TRUONG"
DRAGONFLY STRANGERS,"ALMA AUSTIN, ANNETTE OLSON, CHERYL MURPHY, DORIS REED, EDDIE TOMLIN, GRACE ELLIS, JAMIE RICE, JAY ROBB, KELLY KNOTT, LENA JENSEN, MARCIA DEAN, MARGIE WADE, MARK RINEHART, RANDALL NEUMANN, RICARDO MEADOR, SCOTT SHELLEY, SONIA GREGORY, VIOLET RODRIQUEZ"
DREAM PICKUP,"BRADLEY MOTLEY, CAROLYN PEREZ, CHESTER BENNER, DONNA THOMPSON, FELICIA SUTTON, GUY BROWNLEE, HARVEY GUAJARDO, JANICE WARD, JENNIE TERRY, JOHN FARNSWORTH, MARIAN MENDOZA, MONICA HICKS, NORMAN CURRIER, RAYMOND MCWHORTER, RENE MCALISTER, RICHARD MCCRARY, RICK MATTOX, SONIA GREGORY, STACY CUNNINGHAM, TRAVIS ESTEP, VICTOR BARKLEY, YVONNE WATKINS"
DRIFTER COMMANDMENTS,"AARON SELBY, AGNES BISHOP, ARNOLD HAVENS, ARTHUR SIMPKINS, BETTY WHITE, CHARLES KOWALSKI, CRYSTAL FORD, DEBORAH WALKER, DON BONE, EDUARDO HIATT, ELLA OLIVER, JACKIE LYNCH, JERRY JORDON, JON WILES, JOY GEORGE, JULIA FLORES, KELLY KNOTT, LESLIE SEWARD, MATTIE HOFFMAN, MINNIE ROMERO, PETER MENARD, RAMONA HALE, TOMMY COLLAZO"
DRIVER ANNIE,"BRANDY GRAVES, CHRISTINE ROBERTS, CLINTON BUFORD, COURTNEY DAY, DANIELLE DANIELS, DEAN SAUER, GLENN PULLEN, IVAN CROMWELL, JACK FOUST, KYLE SPURLOCK, LEROY BUSTAMANTE, MILTON HOWLAND, PATRICIA JOHNSON, ROLAND SOUTH, STELLA MORENO, WANDA PATTERSON, WILLIE MARKHAM"
DRIVING POLISH,"ALBERTO HENNING, ALICIA MILLS, BRANDY GRAVES, CHERYL MURPHY, CHRISTOPHER GRECO, COREY HAUSER, ERICA MATTHEWS, ETHEL WEBB, JAMIE WAUGH, JORGE OLIVARES, JOSEPH JOY, MARION SNYDER, PHYLLIS FOSTER, RAUL FORTIER, SALLY PIERCE, SCOTT SHELLEY, TROY QUIGLEY, VANESSA SIMS, VIRGIL WOFFORD, WARREN SHERROD, WILLIE MARKHAM"
DROP WATERFRONT,"ERICA MATTHEWS, GEORGE LINTON, GREG ROBINS, JAIME NETTLES, JEFF EAST, LAURA RODRIGUEZ, MELISSA KING, OSCAR AQUINO, RAMON CHOATE"
DRUMLINE CYCLONE,"AARON SELBY, DENISE KELLY, EILEEN CARR, ELSIE KELLEY, JACOB LANCE, JACQUELINE LONG, LEON BOSTIC, MARION OCAMPO, MARLENE WELCH, MAUREEN LITTLE, TOMMY COLLAZO"
DRUMS DYNAMITE,"CAROLE BARNETT, HILDA HOPKINS, IRMA PEARSON, JAVIER ELROD, JAY ROBB, JIMMIE EGGLESTON, LOUIS LEONE, MARTIN BALES, MARVIN YEE, MELISSA KING, OSCAR AQUINO, PATRICK NEWSOM, PHILIP CAUSEY"
DUCK RACER,"CHESTER BENNER, FELICIA SUTTON, GERALDINE PERKINS, JULIO NOLAND, RUSSELL BRINSON, SHANE MILLARD"
DUDE BLINDNESS,"ANDRE RAPP, CHRISTY VARGAS, CLAUDIA FULLER, DENNIS GILMAN, HARRY ARCE, HAZEL WARREN, JAMIE WAUGH, JENNIE TERRY, KEN PREWITT, LEAH CURTIS, MARJORIE TUCKER, MATTHEW MAHAN, MELINDA FERNANDEZ, NATALIE MEYER, RAMON CHOATE, SHIRLEY ALLEN"
DUFFEL APOCALYPSE,"BRIAN WYMAN, EDWIN BURK, GLENN PULLEN, IVAN CROMWELL, JUSTIN NGO, SAMANTHA DUNCAN, TERRENCE GUNDERSON"
DUMBO LUST,"BERTHA FERGUSON, CHERYL MURPHY, JACK FOUST, JULIO NOLAND, KARL SEAL, NORMAN CURRIER"
DURHAM PANKY,"ALFREDO MCADAMS, CARRIE PORTER, DEAN SAUER, DON BONE, ELIZABETH BROWN, EMILY DIAZ, ENRIQUE FORSYTHE, GABRIEL HARDER, GEORGE LINTON, GLADYS HAMILTON, JAY ROBB, JEAN BELL, JENNY CASTRO, JIMMY SCHRADER, JOANNE ROBERTSON, KARL SEAL, KEVIN SCHULER, LINDA WILLIAMS, MIRIAM MCKINNEY, RAMONA HALE, RICK MATTOX, RUTH MARTINEZ, SARA PERRY, TYLER WREN, VANESSA SIMS"
DWARFS ALTER,"CASEY MENA, ELAINE STEVENS, ERIKA PENA, JACK FOUST, JEFFREY SPEAR, KEITH RICO, KRISTEN CHAVEZ, MICHELLE CLARK, REGINA BERRY"
DYING MAKER,"ANNE POWELL, CATHY SPENCER, CYNTHIA YOUNG, DUSTIN GILLETTE, ESTHER CRAWFORD, ISAAC OGLESBY, JANET PHILLIPS, JULIA FLORES, KEN PREWITT, LEE HAWKS, MARCIA DEAN, MARTHA GONZALEZ, NEIL RENNER, ROY WHITING, TAMMY SANDERS, TINA SIMMONS, WALLACE SLONE"
DYNAMITE TARZAN,"ALAN KAHN, ANDY VANHORN, ANN EVANS, ANTHONY SCHWAB, BRANDON HUEY, CHARLIE BESS, DEAN SAUER, EDNA WEST, ELIZABETH BROWN, EMILY DIAZ, HEATHER MORRIS, HEIDI LARSON, JESSICA HALL, JESUS MCCARTNEY, KEVIN SCHULER, LEONA OBRIEN, LONNIE TIRADO, LORRAINE STEPHENS, MARILYN ROSS, MAUREEN LITTLE, MIKE WAY, PEDRO CHESTNUT, SHEILA WELLS, TODD TAN, VICTORIA GIBSON"
EAGLES PANKY,"BRITTANY RILEY, CHRISTINE ROBERTS, CHRISTY VARGAS, CLIFFORD BOWENS, GORDON ALLARD, JENNIE TERRY, JESSIE MILAM, JON WILES, JOSHUA MARK, LAWRENCE LAWTON, MARIO CHEATHAM, RUBEN GEARY, SETH HANNON, SHERRY MARSHALL, STANLEY SCROGGINS, STEVEN CURLEY, TAMARA NGUYEN, TRACEY BARRETT, TRAVIS ESTEP, VIOLA HANSON, YVONNE WATKINS"
EARLY HOME,"CLAYTON BARBEE, DEBORAH WALKER, IRENE PRICE, JOSEPHINE GOMEZ, THOMAS GRIGSBY, TONYA CHAPMAN, TRAVIS ESTEP"
EARRING INSTINCT,"AMANDA CARTER, AMBER DIXON, ANDY VANHORN, BILLIE HORTON, CARLOS COUGHLIN, CHRISTY VARGAS, EMILY DIAZ, GUY BROWNLEE, JUAN FRALEY, JUANITA MASON, KRISTIN JOHNSTON, LESLIE GORDON, LUCY WHEELER, MARK RINEHART, RENEE LANE, SHAWN HEATON, SIDNEY BURLESON, VANESSA SIMS, VICTORIA GIBSON"
EARTH VISION,"ALVIN DELOACH, ANNE POWELL, ANNIE RUSSELL, ASHLEY RICHARDSON, BECKY MILES, CAROL GARCIA, CAROLE BARNETT, CORY MEEHAN, DAISY BATES, DANIELLE DANIELS, DORIS REED, ELLA OLIVER, GINA WILLIAMSON, HILDA HOPKINS, IRENE PRICE, MABEL HOLLAND, MINNIE ROMERO, RON DELUCA, SERGIO STANFIELD, STEPHEN QUALLS, VERONICA STONE, WESLEY BULL, WILLIE HOWELL"
EASY GLADIATOR,"CARRIE PORTER, CHARLIE BESS, CORY MEEHAN, CRYSTAL FORD, CURTIS IRBY, CYNTHIA YOUNG, DONNA THOMPSON, ERIC ROBERT, FRANCIS SIKES, JEAN BELL, JOAN COOPER, JUAN FRALEY, JUSTIN NGO, KATHRYN COLEMAN, KATHY JAMES, KELLY TORRES, MELISSA KING, MITCHELL WESTMORELAND, RENEE LANE, ROBERT BAUGHMAN, RONALD WEINER, YOLANDA WEAVER"
EDGE KISSING,"BILL GAVIN, CECIL VINES, DEAN SAUER, DERRICK BOURQUE, EDWARD BAUGH, GILBERT SLEDGE, JIMMY SCHRADER, JULIO NOLAND, MARGIE WADE, MYRTLE FLEMING, NATALIE MEYER, RAMONA HALE, SCOTT SHELLEY, SIDNEY BURLESON, VICKI FIELDS"
EFFECT GLADIATOR,"ADRIAN CLARY, AGNES BISHOP, ALVIN DELOACH, ANA BRADLEY, CALVIN MARTEL, DAISY BATES, DERRICK BOURQUE, EDGAR RHOADS, ENRIQUE FORSYTHE, FRANCIS SIKES, GABRIEL HARDER, JEANETTE GREENE, JERRY JORDON, JOEL FRANCISCO, JUDY GRAY, LENA JENSEN, RAMON CHOATE, REGINA BERRY, RONALD WEINER, ROSS GREY, SHERRI RHODES, STEPHEN QUALLS, SUE PETERS, TERRANCE ROUSH"
EGG IGBY,"CASSANDRA WALTERS, CHRISTOPHER GRECO, CLARENCE GAMEZ, CODY NOLEN, ELMER NOE, EVERETT BANDA, FRANK WAGGONER, GERALDINE PERKINS, HEATHER MORRIS, JOSEPHINE GOMEZ, JUSTIN NGO, LAURA RODRIGUEZ, MEGAN PALMER, PAULINE HENRY, ROGER QUINTANILLA, SANDRA MARTIN, SHARON ROBINSON, SHEILA WELLS, TODD TAN, VELMA LUCAS, WILLIAM SATTERFIELD"
EGYPT TENENBAUMS,"ALVIN DELOACH, ARLENE HARVEY, CASEY MENA, CINDY FISHER, ELEANOR HUNT, JOSE ANDREW, JOSEPH JOY, KIMBERLY LEE, KRISTINA CHAMBERS, LAWRENCE LAWTON, LOUIS LEONE, OSCAR AQUINO, PEGGY MYERS, RENE MCALISTER, ROBERT BAUGHMAN, SAMUEL MARLOW, VIRGINIA GREEN"
ELEMENT FREDDY,"CARL ARTIS, DEBRA NELSON, ERIN DUNN, GEORGIA JACOBS, JACQUELINE LONG, JORGE OLIVARES, LLOYD DOWD, LOIS BUTLER, MANUEL MURRELL, NICHOLAS BARFIELD"
ELEPHANT TROJAN,"CHRISTINA RAMIREZ, CRYSTAL FORD, DAVE GARDINER, EARL SHANKS, ELSIE KELLEY, IDA ANDREWS, ISAAC OGLESBY, JEFFREY SPEAR, JESSICA HALL, JOHNNY TURPIN, JOSEPHINE GOMEZ, JOYCE EDWARDS, PHILLIP HOLM, TRAVIS ESTEP"
ELF MURDER,"ANNIE RUSSELL, BRETT CORNWELL, EDGAR RHOADS, JACOB LANCE, MABEL HOLLAND, MARJORIE TUCKER, SALLY PIERCE"
ELIZABETH SHANE,"BILLY POULIN, CHRISTOPHER GRECO, DAISY BATES, ETHEL WEBB, JOYCE EDWARDS, LONNIE TIRADO, MARIE TURNER, PERRY SWAFFORD, SAMUEL MARLOW, VIOLET RODRIQUEZ"
EMPIRE MALKOVICH,"ANGELA HERNANDEZ, APRIL BURNS, CAROLINE BOWMAN, CHRISTY VARGAS, DEREK BLAKELY, GLADYS HAMILTON, GLEN TALBERT, JENNIFER DAVIS, JULIE SANCHEZ, JUSTIN NGO, LANCE PEMBERTON, MATTIE HOFFMAN, MELISSA KING, RITA GRAHAM, SHIRLEY ALLEN, STELLA MORENO, THEODORE CULP, WADE DELVALLE, WANDA PATTERSON"
ENCINO ELF,"ADRIAN CLARY, BETH FRANKLIN, CARMEN OWENS, CLARA SHAW, CLAUDIA FULLER, ERIK GUILLEN, FELICIA SUTTON, HERMAN DEVORE, JONATHAN SCARBOROUGH, JUDITH COX, JUDY GRAY, KIMBERLY LEE, LAWRENCE LAWTON, LEO EBERT, PHILLIP HOLM, RITA GRAHAM, TONI HOLT, TYRONE ASHER, VICKI FIELDS"
ENCOUNTERS CURTAIN,"ALEX GRESHAM, ALEXANDER FENNELL, CLYDE TOBIAS, DENNIS GILMAN, EMMA BOYD, ERICA MATTHEWS, GLEN TALBERT, GUY BROWNLEE, IRENE PRICE, JUSTIN NGO, LEONARD SCHOFIELD, LOIS BUTLER, MARION SNYDER, MAXINE SILVA, MORRIS MCCARTER, RALPH MADRIGAL, SIDNEY BURLESON, VELMA LUCAS, YOLANDA WEAVER"
ENDING CROWDS,"ANDREA HENDERSON, CALVIN MARTEL, CHRISTIAN JUNG, JAY ROBB, JENNIE TERRY, LUIS YANEZ, MARSHALL THORN, MARTHA GONZALEZ, NATHANIEL ADAM, RUSSELL BRINSON, TERRI VASQUEZ"
ENEMY ODDS,"ALEX GRESHAM, ALLAN CORNISH, CARLOS COUGHLIN, CASSANDRA WALTERS, CHARLIE BESS, CHESTER BENNER, DAISY BATES, DUANE TUBBS, GREG ROBINS, HARRY ARCE, HILDA HOPKINS, JOHNNY TURPIN, JOSHUA MARK, JUAN FRALEY, JULIA FLORES, KRISTIN JOHNSTON, LAURIE LAWRENCE, LEO EBERT, LEROY BUSTAMANTE, LLOYD DOWD, MARIE TURNER, MELANIE ARMSTRONG, NELLIE GARRETT, OSCAR AQUINO, ROBERTO VU, SERGIO STANFIELD, STACEY MONTGOMERY, THOMAS GRIGSBY, VIRGIL WOFFORD"
ENGLISH BULWORTH,"BOB PFEIFFER, CATHY SPENCER, CHARLOTTE HUNTER, DAISY BATES, DEREK BLAKELY, EDGAR RHOADS, EDNA WEST, ELEANOR HUNT, JENNIFER DAVIS, JIMMIE EGGLESTON, JON WILES, JOSEPHINE GOMEZ, KARL SEAL, KATHRYN COLEMAN, KELLY KNOTT, LOUISE JENKINS, MARGIE WADE, MARIAN MENDOZA, MITCHELL WESTMORELAND, NATHAN RUNYON, NORMAN CURRIER, PATSY DAVIDSON, REGINA BERRY, RENE MCALISTER, ROBERT BAUGHMAN, RUSSELL BRINSON, TONI HOLT, TYLER WREN, VIRGIL WOFFORD"
ENOUGH RAGING,"ALFREDO MCADAMS, ANNIE RUSSELL, BRANDON HUEY, BRYAN HARDISON, CHARLES KOWALSKI, DARRYL ASHCRAFT, DIANE COLLINS, ELIZABETH BROWN, EVERETT BANDA, GRACE ELLIS, GUY BROWNLEE, HERMAN DEVORE, JASON MORRISSEY, KAREN JACKSON, KELLY TORRES, KRISTINA CHAMBERS, MITCHELL WESTMORELAND, WALTER PERRYMAN"
ENTRAPMENT SATISFACTION,"BEVERLY BROOKS, ERIKA PENA, GRACE ELLIS, HECTOR POINDEXTER, JAY ROBB, JIM REA, KRISTIN JOHNSTON, LAURA RODRIGUEZ, LESLIE SEWARD, MATHEW BOLIN, RHONDA KENNEDY, SETH HANNON, TONI HOLT, VIRGINIA GREEN, WALLACE SLONE"
ESCAPE METROPOLIS,"ANGELA HERNANDEZ, BOB PFEIFFER, BONNIE HUGHES, BRUCE SCHWARZ, CARMEN OWENS, CASEY MENA, DENISE KELLY, ERIN DUNN, GERALD FULTZ, GINA WILLIAMSON, GLENDA FRAZIER, ISAAC OGLESBY, JAMES GANNON, JILL HAWKINS, KEITH RICO, LEE HAWKS, MAE FLETCHER, MIGUEL BETANCOURT, NINA SOTO, RUSSELL BRINSON, RUTH MARTINEZ, SCOTT SHELLEY, SHANE MILLARD, TAMARA NGUYEN, TRACY COLE"
EVE RESURRECTION,"BRANDON HUEY, GERTRUDE CASTILLO, GILBERT SLEDGE, JORDAN ARCHULETA, RAYMOND MCWHORTER, SARAH LEWIS, VIVIAN RUIZ"
EVERYONE CRAFT,"ADAM GOOCH, ALVIN DELOACH, ANNE POWELL, CLAUDIA FULLER, EDDIE TOMLIN, GLADYS HAMILTON, HEIDI LARSON, KATIE ELLIOTT, LORETTA CARPENTER, PEARL GARZA, ROLAND SOUTH, TIM CARY, VIOLA HANSON"
EVOLUTION ALTER,"ARMANDO GRUBER, EVERETT BANDA, GABRIEL HARDER, GEORGE LINTON, HILDA HOPKINS, KELLY KNOTT, MATHEW BOLIN, NICOLE PETERSON, PAULINE HENRY, SIDNEY BURLESON, SYLVIA ORTIZ, WILMA RICHARDS"
EXCITEMENT EVE,"BERTHA FERGUSON, CARMEN OWENS, CASEY MENA, CHRISTOPHER GRECO, CURTIS IRBY, DENNIS GILMAN, EVELYN MORGAN, FRANKLIN TROUTMAN, GAIL KNIGHT, GERTRUDE CASTILLO, GILBERT SLEDGE, IAN STILL, JEFFERY PINSON, JOYCE EDWARDS, JUDY GRAY, KEN PREWITT, LENA JENSEN, MATTHEW MAHAN, RITA GRAHAM, ROSE HOWARD, SYLVIA ORTIZ"
EXORCIST STING,"ALMA AUSTIN, DAVE GARDINER, DOUGLAS GRAF, HERMAN DEVORE, JENNIFER DAVIS, JOHNNIE CHISHOLM, LEE HAWKS, LOUIS LEONE, NICHOLAS BARFIELD, PEDRO CHESTNUT, RICHARD MCCRARY, VINCENT RALSTON, WALTER PERRYMAN"
EXPECATIONS NATURAL,"AARON SELBY, ALLAN CORNISH, BERNICE WILLIS, DEANNA BYRD, EDWIN BURK, GAIL KNIGHT, IVAN CROMWELL, JACKIE LYNCH, JARED ELY, JOY GEORGE, KURT EMMONS, MARILYN ROSS, MARY SMITH, MICHAEL SILVERMAN, PHILLIP HOLM, STEVE MACKENZIE, TAMARA NGUYEN, ZACHARY HITE"
EXPENDABLE STALLION,"ANGELA HERNANDEZ, BILLIE HORTON, BRITTANY RILEY, CHRISTINA RAMIREZ, CLAUDE HERZOG, DOLORES WAGNER, DON BONE, ELSIE KELLEY, ETHEL WEBB, JACK FOUST, JEANNE LAWSON, JENNY CASTRO, JESSE SCHILLING, JESSICA HALL, JO FOWLER, JOANN GARDNER, JOSEPHINE GOMEZ, JUDITH COX, KEN PREWITT, LAWRENCE LAWTON, MARK RINEHART, MIKE WAY, ROSA REYNOLDS, SUZANNE NICHOLS, TERRI VASQUEZ, TONYA CHAPMAN, TROY QUIGLEY"
EXPRESS LONELY,"ALBERT CROUSE, ALFREDO MCADAMS, CARL ARTIS, DON BONE, EDNA WEST, JORDAN ARCHULETA, KEITH RICO, MARVIN YEE, MEGAN PALMER, SHEILA WELLS, STACY CUNNINGHAM, STELLA MORENO, TROY QUIGLEY"
EXTRAORDINARY CONQUERER,"AMY LOPEZ, CATHERINE CAMPBELL, DAN PAINE, GLENDA FRAZIER, KENNETH GOODEN, MANUEL MURRELL"
EYES DRIVING,"ALFRED CASILLAS, ARTHUR SIMPKINS, CHESTER BENNER, CLIFTON MALCOLM, DANIELLE DANIELS, ELSIE KELLEY, JASON MORRISSEY, JOHNNIE CHISHOLM, JON WILES, JOSHUA MARK, JUNE CARROLL, JUSTIN NGO, MAX PITT, MICHELE GRANT, RICK MATTOX, ROBERTO VU, TERESA ROGERS, WILLIE HOWELL"
FACTORY DRAGON,"DAISY BATES, GINA WILLIAMSON, JANE BENNETT, JEANNE LAWSON, JESSIE BANKS, JESUS MCCARTNEY, JULIAN VEST, KEVIN SCHULER, MABEL HOLLAND, MATTIE HOFFMAN, PEGGY MYERS, ROBERTA HARPER, ROSS GREY, SYLVIA ORTIZ, TERRY CARLSON, VERONICA STONE, VIVIAN RUIZ"
FALCON VOLUME,"ALICE STEWART, CARLOS COUGHLIN, CATHY SPENCER, DARRYL ASHCRAFT, ELMER NOE, GAIL KNIGHT, HELEN HARRIS, JAVIER ELROD, KYLE SPURLOCK, LUCY WHEELER, MAE FLETCHER, MARIE TURNER, MARJORIE TUCKER, MICHELE GRANT, NICHOLAS BARFIELD, RITA GRAHAM, SHAWN HEATON, TED BREAUX, TROY QUIGLEY, TYLER WREN, TYRONE ASHER, WILLIAM SATTERFIELD"
FAMILY SWEET,"ARNOLD HAVENS, AUSTIN CINTRON, CALVIN MARTEL, CASEY MENA, CHERYL MURPHY, CORY MEEHAN, ELEANOR HUNT, ERICA MATTHEWS, JEFF EAST, JULIE SANCHEZ, KEN PREWITT, KRISTEN CHAVEZ, MARC OUTLAW, MARION OCAMPO, MARTHA GONZALEZ, MARVIN YEE, MAX PITT, MIGUEL BETANCOURT, NANCY THOMAS, NAOMI JENNINGS, RAY HOULE, SALLY PIERCE, TERRY CARLSON, TERRY GRISSOM, THERESA WATSON, TOMMY COLLAZO, TONY CARRANZA, VINCENT RALSTON, YVONNE WATKINS"
FANTASIA PARK,"ANDREA HENDERSON, CLYDE TOBIAS, DEREK BLAKELY, FLOYD GANDY, FRANCIS SIKES, GLORIA COOK, IDA ANDREWS, KIM CRUZ, LENA JENSEN, LISA ANDERSON, MELVIN ELLINGTON, RANDALL NEUMANN, ROSS GREY, SHAWN HEATON, SHERRI RHODES, TOMMY COLLAZO, TRACEY BARRETT, WALLACE SLONE"
FANTASY TROOPERS,"ALLEN BUTTERFIELD, ALLISON STANLEY, ALMA AUSTIN, ASHLEY RICHARDSON, CHRISTY VARGAS, CLARENCE GAMEZ, DAISY BATES, ELLEN SIMPSON, GERTRUDE CASTILLO, GLENDA FRAZIER, HOLLY FOX, JILL HAWKINS, JUAN FRALEY, LAWRENCE LAWTON, LOUISE JENKINS, MAE FLETCHER, MATTHEW MAHAN, NANCY THOMAS, NATHAN RUNYON, PATRICIA JOHNSON, SUE PETERS, THEODORE CULP, THERESA WATSON, WAYNE TRUONG"
FARGO GANDHI,"ANDRE RAPP, ASHLEY RICHARDSON, BERNICE WILLIS, BYRON BOX, CARRIE PORTER, CLINTON BUFORD, DAN PAINE, DARRELL POWER, EDWARD BAUGH, GILBERT SLEDGE, HERMAN DEVORE, JAIME NETTLES, JENNIE TERRY, JESUS MCCARTNEY, LEON BOSTIC, LISA ANDERSON, MANUEL MURRELL, MARTHA GONZALEZ, MARVIN YEE, MATTHEW MAHAN, RON DELUCA, TAMMY SANDERS, TONY CARRANZA, TYLER WREN"
FATAL HAUNTED,"ANGEL BARCLAY, BYRON BOX, CHERYL MURPHY, CLARA SHAW, COURTNEY DAY, CRAIG MORRELL, EDGAR RHOADS, ENRIQUE FORSYTHE, ERIK GUILLEN, GAIL KNIGHT, GERALDINE PERKINS, GINA WILLIAMSON, JAMIE WAUGH, JOSEPH JOY, LORRAINE STEPHENS, MARGARET MOORE, MARIA MILLER, MORRIS MCCARTER, PENNY NEAL, RAMONA HALE, SEAN DOUGLASS, STACY CUNNINGHAM, TAMMY SANDERS, TERRANCE ROUSH, TERRI VASQUEZ, TERRY CARLSON, THOMAS GRIGSBY, TIMOTHY BUNN"
FEATHERS METAL,"BOB PFEIFFER, CATHY SPENCER, CLAUDIA FULLER, GERTRUDE CASTILLO, LOIS BUTLER, PHILLIP HOLM, RENE MCALISTER, SHERRI RHODES, TANYA GILBERT, TED BREAUX, WADE DELVALLE"
FELLOWSHIP AUTUMN,"AARON SELBY, BONNIE HUGHES, BRANDON HUEY, BRUCE SCHWARZ, CASSANDRA WALTERS, DOLORES WAGNER, EMMA BOYD, FRANCES PARKER, FRANCIS SIKES, FRANK WAGGONER, GREG ROBINS, JAIME NETTLES, JOHNNIE CHISHOLM, JULIA FLORES, LESTER KRAUS, MARLENE WELCH, MONICA HICKS, PHILLIP HOLM, RAY HOULE, RITA GRAHAM, ROSE HOWARD, SHAWN HEATON, TYLER WREN, VINCENT RALSTON"
FERRIS MOTHER,"ALMA AUSTIN, ANDREW PURDY, ASHLEY RICHARDSON, COLLEEN BURTON, GLADYS HAMILTON, JANET PHILLIPS, JEFF EAST, JIMMIE EGGLESTON, JULIE SANCHEZ, MARY SMITH, OLGA JIMENEZ, PEGGY MYERS, PENNY NEAL, RAMONA HALE, ROSE HOWARD, RUSSELL BRINSON, THELMA MURRAY"
