film_title,customers
RESERVOIR ADAPTATION,"ANGELA HERNANDEZ, BEATRICE ARNOLD, CLIFTON MALCOLM, COURTNEY DAY, MARCIA DEAN, MAX PITT, MIKE WAY, NINA SOTO, ROSS GREY, WESLEY BULL"
RESURRECTION SILVERADO,"BEATRICE ARNOLD, BETH FRANKLIN, CAROLINE BOWMAN, CARRIE PORTER, CATHERINE CAMPBELL, COREY HAUSER, ELMER NOE, HEATHER MORRIS, HILDA HOPKINS, JANE BENNETT, JIMMIE EGGLESTON, JON WILES, JUDITH COX, MANUEL MURRELL, MARGIE WADE, MELANIE ARMSTRONG, MICHEAL FORMAN, NORMA GONZALES, RAY HOULE, SIDNEY BURLESON, VIRGINIA GREEN"
REUNION WITCHES,"ALICE STEWART, BARBARA JONES, BRYAN HARDISON, CHARLIE BESS, CINDY FISHER, CLYDE TOBIAS, DEBRA NELSON, FELICIA SUTTON, FRANCES PARKER, GUY BROWNLEE, JACKIE LYNCH, JAVIER ELROD, JOHNNY TURPIN, JULIO NOLAND, LEROY BUSTAMANTE, MARSHALL THORN, MINNIE ROMERO, REGINALD KINDER, SALVADOR TEEL, VIVIAN RUIZ"
RIDER CADDYSHACK,"ADRIAN CLARY, BONNIE HUGHES, CODY NOLEN, FLORENCE WOODS, GORDON ALLARD, KENNETH GOODEN, KRISTEN CHAVEZ, MARSHA DOUGLAS, SAMANTHA DUNCAN, TANYA GILBERT, VERONICA STONE"
RIDGEMONT SUBMARINE,"ALAN KAHN, ANGEL BARCLAY, ARMANDO GRUBER, AUDREY RAY, BOBBY BOUDREAU, CATHERINE CAMPBELL, DAVID ROYAL, ERIN DUNN, ETHEL WEBB, GREGORY MAULDIN, JEAN BELL, JENNIE TERRY, JENNIFER DAVIS, JEROME KENYON, JOANNE ROBERTSON, JOYCE EDWARDS, KARL SEAL, KATHERINE RIVERA, LEONARD SCHOFIELD, LESLIE GORDON, LESLIE SEWARD, LUIS YANEZ, MARIA MILLER, NEIL RENNER, OLGA JIMENEZ, RALPH MADRIGAL, REGINA BERRY, ROLAND SOUTH, RUBY WASHINGTON, SHERRY MARSHALL, SUZANNE NICHOLS, TANYA GILBERT"
RIGHT CRANES,"ALEX GRESHAM, ANGELA HERNANDEZ, BEATRICE ARNOLD, GAIL KNIGHT, JESSE SCHILLING, JOYCE EDWARDS, LEWIS LYMAN, MARIAN MENDOZA, RONALD WEINER, SHELLY WATTS"
RINGS HEARTBREAKERS,"AMANDA CARTER, CHESTER BENNER, CHRISTIAN JUNG, CORY MEEHAN, DENISE KELLY, ELLA OLIVER, ELMER NOE, GINA WILLIAMSON, LARRY THRASHER, LEAH CURTIS, LINDA WILLIAMS, LUCILLE HOLMES, SARAH LEWIS, STEVEN CURLEY, WILLIAM SATTERFIELD"
RIVER OUTLAW,"AMBER DIXON, ANDY VANHORN, ARLENE HARVEY, CAROLYN PEREZ, CHRISTY VARGAS, CLARA SHAW, DANIELLE DANIELS, DAWN SULLIVAN, DENISE KELLY, DWIGHT LOMBARDI, ELIZABETH BROWN, EVELYN MORGAN, FLORENCE WOODS, MARK RINEHART, MICHAEL SILVERMAN, OLGA JIMENEZ, PAULINE HENRY, PHILLIP HOLM, SHERRY MARSHALL, TRACY HERRMANN"
ROAD ROXANNE,"BEN EASTER, CHARLES KOWALSKI, CHRISTOPHER GRECO, CINDY FISHER, CONSTANCE REID, DORA MEDINA, GUY BROWNLEE, HECTOR POINDEXTER, JIM REA, LOUISE JENKINS, LYDIA BURKE, MILTON HOWLAND, PERRY SWAFFORD, RICHARD MCCRARY, STEPHANIE MITCHELL, THEODORE CULP, THERESA WATSON, TRACY COLE, ZACHARY HITE"
ROBBERS JOON,"ALEXANDER FENNELL, ALVIN DELOACH, ANGEL BARCLAY, BEN EASTER, CLYDE TOBIAS, COURTNEY DAY, CRAIG MORRELL, DARRYL ASHCRAFT, DEAN SAUER, DOUGLAS GRAF, ERNEST STEPP, GARY COY, GERALDINE PERKINS, GORDON ALLARD, GRACE ELLIS, HOWARD FORTNER, JAMIE WAUGH, JUAN FRALEY, LAURA RODRIGUEZ, LILLIAN GRIFFIN, LOIS BUTLER, MARTHA GONZALEZ, NANCY THOMAS, REBECCA SCOTT, REGINALD KINDER, SHARON ROBINSON, SHAWN HEATON, STEVEN CURLEY, TERRENCE GUNDERSON, VIOLA HANSON, ZACHARY HITE"
ROBBERY BRIGHT,"ADRIAN CLARY, ANNETTE OLSON, EDWIN BURK, ELEANOR HUNT, ERIN DUNN, GLADYS HAMILTON, JAIME NETTLES, KARL SEAL, LORI WOOD, MANUEL MURRELL, MARSHA DOUGLAS, REGINA BERRY, SYLVIA ORTIZ"
ROCK INSTINCT,"CONNIE WALLACE, DARLENE ROSE, ELLA OLIVER, FELICIA SUTTON, GREGORY MAULDIN, HOLLY FOX, JACOB LANCE, KEN PREWITT, LOIS BUTLER, MELVIN ELLINGTON, NANCY THOMAS, REGINA BERRY, SAMANTHA DUNCAN, WARREN SHERROD, YOLANDA WEAVER"
ROCKETEER MOTHER,"ALMA AUSTIN, AMANDA CARTER, ANDRE RAPP, ANDREW PURDY, APRIL BURNS, ARMANDO GRUBER, BETTY WHITE, BRETT CORNWELL, CLAUDE HERZOG, DANIELLE DANIELS, DANNY ISOM, DEBRA NELSON, EVELYN MORGAN, FLOYD GANDY, GEORGE LINTON, GERTRUDE CASTILLO, GUY BROWNLEE, HARVEY GUAJARDO, HENRY BILLINGSLEY, IVAN CROMWELL, JORGE OLIVARES, JULIE SANCHEZ, KEVIN SCHULER, MARIAN MENDOZA, MARTHA GONZALEZ, MISTY LAMBERT, PHYLLIS FOSTER, RICHARD MCCRARY, ROSS GREY, THELMA MURRAY, ZACHARY HITE"
ROCKY WAR,"AGNES BISHOP, AMY LOPEZ, BERTHA FERGUSON, BETTY WHITE, DIANE COLLINS, GABRIEL HARDER, JACKIE LYNCH, JASON MORRISSEY, JEAN BELL, JOSEPH JOY, KIM CRUZ, LAUREN HUDSON, MINNIE ROMERO, MYRTLE FLEMING, NATHANIEL ADAM, TIFFANY JORDAN"
ROLLERCOASTER BRINGING,"ANA BRADLEY, BARBARA JONES, CAROL GARCIA, DANNY ISOM, EDNA WEST, FREDERICK ISBELL, LISA ANDERSON, SHEILA WELLS, TERRENCE GUNDERSON, THEODORE CULP"
ROMAN PUNK,"ANDRE RAPP, ANTONIO MEEK, BERNICE WILLIS, BILL GAVIN, BRANDON HUEY, CRAIG MORRELL, ESTHER CRAWFORD, FRANCIS SIKES, GERTRUDE CASTILLO, JOHNNY TURPIN, KELLY KNOTT, KENT ARSENAULT, KIMBERLY LEE, KRISTIN JOHNSTON, LEONARD SCHOFIELD, MICHELLE CLARK, RAMONA HALE, ROGER QUINTANILLA, RUTH MARTINEZ, STEVEN CURLEY, TERRY GRISSOM, VERONICA STONE, WILLIE HOWELL"
ROOM ROMAN,"BECKY MILES, CARLA GUTIERREZ, DARREN WINDHAM, ELIZABETH BROWN, ELSIE KELLEY, HUGH WALDROP, IRMA PEARSON, KATHLEEN ADAMS, KYLE SPURLOCK, LARRY THRASHER, LEE HAWKS, LORRAINE STEPHENS, MARC OUTLAW, MICHAEL SILVERMAN, MICHEAL FORMAN, ROBIN HAYES, RONALD WEINER, SERGIO STANFIELD, TIM CARY, WAYNE TRUONG"
ROOTS REMEMBER,"ANDREW PURDY, ANDY VANHORN, CALVIN MARTEL, CASEY MENA, CLARENCE GAMEZ, CRYSTAL FORD, DEBORAH WALKER, EMILY DIAZ, GEORGE LINTON, HEATHER MORRIS, JAIME NETTLES, JESSICA HALL, JUDITH COX, KURT EMMONS, MARCIA DEAN, ROBERTA HARPER, WILMA RICHARDS"
ROSES TREASURE,"ALAN KAHN, ANNA HILL, BEN EASTER, BERNARD COLBY, BRUCE SCHWARZ, CASSANDRA WALTERS, CHERYL MURPHY, CODY NOLEN, CONNIE WALLACE, DAISY BATES, DARLENE ROSE, DAVE GARDINER, DUSTIN GILLETTE, EDUARDO HIATT, HENRY BILLINGSLEY, IDA ANDREWS, JESSIE BANKS, JESSIE MILAM, JIM REA, KATHLEEN ADAMS, LARRY THRASHER, LEE HAWKS, MARION OCAMPO, RAMONA HALE, SARA PERRY, TYLER WREN, WARREN SHERROD"
ROUGE SQUAD,"ANDRE RAPP, ANGEL BARCLAY, BEATRICE ARNOLD, CLAYTON BARBEE, DEANNA BYRD, FLOYD GANDY, FRANKLIN TROUTMAN, HAZEL WARREN, JAIME NETTLES, JEFFREY SPEAR, JESSIE MILAM, KIM CRUZ, NICOLE PETERSON, RALPH MADRIGAL, REBECCA SCOTT, RICKY SHELBY, WESLEY BULL"
ROXANNE REBEL,"BOB PFEIFFER, CHRISTOPHER GRECO, COURTNEY DAY, DIANA ALEXANDER, GENE SANBORN, GILBERT SLEDGE, GINA WILLIAMSON, GLENDA FRAZIER, JAY ROBB, KIRK STCLAIR, PETER MENARD, RHONDA KENNEDY, SHARON ROBINSON, SHELLY WATTS, TAMMY SANDERS, TED BREAUX, TERRENCE GUNDERSON, TRACY HERRMANN"
RUGRATS SHAKESPEARE,"ALVIN DELOACH, CLIFTON MALCOLM, CONNIE WALLACE, CRYSTAL FORD, DIANE COLLINS, GLADYS HAMILTON, JAIME NETTLES, JESSIE MILAM, JIMMY SCHRADER, JOANNE ROBERTSON, JOSEPH JOY, JOSEPHINE GOMEZ, JOYCE EDWARDS, KEVIN SCHULER, KRISTEN CHAVEZ, MEGAN PALMER, MINNIE ROMERO, NEIL RENNER, PATRICIA JOHNSON, PEDRO CHESTNUT, RANDALL NEUMANN, RITA GRAHAM, RON DELUCA, ROSEMARY SCHMIDT, RUSSELL BRINSON, SARA PERRY, SHELLY WATTS, SHIRLEY ALLEN, STEPHANIE MITCHELL, VIRGINIA GREEN"
RULES HUMAN,"ALEX GRESHAM, ALICIA MILLS, BERNICE WILLIS, BRENT HARKINS, CALVIN MARTEL, CARL ARTIS, DANIEL CABRAL, FRANK WAGGONER, GLADYS HAMILTON, JESSIE MILAM, LEON BOSTIC, PETER MENARD, RALPH MADRIGAL, SAM MCDUFFIE, SONIA GREGORY, STEPHEN QUALLS"
RUN PACIFIC,"APRIL BURNS, CLIFFORD BOWENS, CLIFTON MALCOLM, EARL SHANKS, JAY ROBB, JOHN FARNSWORTH, JUDY GRAY, MARIA MILLER, MORRIS MCCARTER, ROSEMARY SCHMIDT"
RUNAWAY TENENBAUMS,"BETH FRANKLIN, DAISY BATES, DARREN WINDHAM, GERALDINE PERKINS, HARRY ARCE, RITA GRAHAM, ROSEMARY SCHMIDT, TOM MILNER"
RUNNER MADIGAN,"ALEX GRESHAM, BRANDON HUEY, JOAN COOPER, LILLIAN GRIFFIN, MARTIN BALES, PHILLIP HOLM, RENEE LANE, RONALD WEINER"
RUSH GOODFELLAS,"ALEXANDER FENNELL, BILL GAVIN, BILLIE HORTON, CARLA GUTIERREZ, CAROLE BARNETT, CHRISTIAN JUNG, CRYSTAL FORD, DAVE GARDINER, DIANA ALEXANDER, DOUGLAS GRAF, DUANE TUBBS, FREDERICK ISBELL, GABRIEL HARDER, HEIDI LARSON, JIM REA, JULIA FLORES, KRISTEN CHAVEZ, LAURIE LAWRENCE, LEON BOSTIC, MICHELLE CLARK, OSCAR AQUINO, PENNY NEAL, RANDY GAITHER, ROLAND SOUTH, RUBY WASHINGTON, SEAN DOUGLASS, TOM MILNER, TONI HOLT, VIOLA HANSON"
RUSHMORE MERMAID,"ALFREDO MCADAMS, DEBORAH WALKER, GABRIEL HARDER, ROSS GREY, RYAN SALISBURY, SAMANTHA DUNCAN"
SABRINA MIDNIGHT,"ANA BRADLEY, ARMANDO GRUBER, BEVERLY BROOKS, BRADLEY MOTLEY, BRETT CORNWELL, CLARA SHAW, COLLEEN BURTON, EDITH MCDONALD, GERALD FULTZ, GILBERT SLEDGE, HARRY ARCE, JASON MORRISSEY, MARION OCAMPO, MAX PITT, MILTON HOWLAND, NICOLE PETERSON, RALPH MADRIGAL, RONALD WEINER, ROSEMARY SCHMIDT, SAMUEL MARLOW, WILLIAM SATTERFIELD"
SADDLE ANTITRUST,"BYRON BOX, CHARLES KOWALSKI, COREY HAUSER, CYNTHIA YOUNG, HEATHER MORRIS, JEANETTE GREENE, LEAH CURTIS, MEGAN PALMER, NAOMI JENNINGS, OLGA JIMENEZ, RAUL FORTIER, REBECCA SCOTT, RUTH MARTINEZ"
SAGEBRUSH CLUELESS,"ALBERT CROUSE, CASSANDRA WALTERS, CLARA SHAW, EDGAR RHOADS, EDUARDO HIATT, GENE SANBORN, HAZEL WARREN, IDA ANDREWS, IVAN CROMWELL, JENNY CASTRO, JONATHAN SCARBOROUGH, RAFAEL ABNEY, REGINA BERRY, RUTH MARTINEZ, SAM MCDUFFIE, TERRY CARLSON"
SAINTS BRIDE,"BRENT HARKINS, BRITTANY RILEY, DUANE TUBBS, JESSICA HALL, JIMMIE EGGLESTON, KATHY JAMES, KYLE SPURLOCK, LUIS YANEZ"
SALUTE APOLLO,"ANNETTE OLSON, CLIFFORD BOWENS, DELORES HANSEN, EDWARD BAUGH, ELLEN SIMPSON, FELICIA SUTTON, FLORENCE WOODS, GLORIA COOK, LEROY BUSTAMANTE, LINDA WILLIAMS, MARGIE WADE, MICHELLE CLARK, NATHAN RUNYON, NICOLE PETERSON, RAUL FORTIER, RUBEN GEARY, SALVADOR TEEL, SHANNON FREEMAN, SUE PETERS, TARA RYAN, TERRANCE ROUSH, THOMAS GRIGSBY, TROY QUIGLEY"
SAMURAI LION,"BRANDON HUEY, CHARLOTTE HUNTER, CINDY FISHER, CLINTON BUFORD, DALE RATCLIFF, DEBRA NELSON, EDUARDO HIATT, ELLA OLIVER, GLENDA FRAZIER, HARRY ARCE, HECTOR POINDEXTER, ISAAC OGLESBY, IVAN CROMWELL, JANET PHILLIPS, JON WILES, JOY GEORGE, JUDY GRAY, KRISTINA CHAMBERS, LLOYD DOWD, MARGIE WADE, PATRICK NEWSOM, RAY HOULE, TODD TAN, TRACY COLE, TROY QUIGLEY"
SANTA PARIS,"JORDAN ARCHULETA, JUNE CARROLL, JUSTIN NGO, MARTHA GONZALEZ, MAUREEN LITTLE, NELLIE GARRETT, PHILIP CAUSEY, SCOTT SHELLEY, SUE PETERS, TODD TAN, WARREN SHERROD"
SASSY PACKER,"BEN EASTER, BENJAMIN VARNEY, BERNARD COLBY, BERNICE WILLIS, BRENT HARKINS, CHAD CARBONE, DAWN SULLIVAN, DIANE COLLINS, EDUARDO HIATT, EVELYN MORGAN, GEORGIA JACOBS, STACY CUNNINGHAM, TERRY CARLSON"
SATISFACTION CONFIDENTIAL,"ANA BRADLEY, ANGEL BARCLAY, CHESTER BENNER, DAISY BATES, DAVID ROYAL, DWAYNE OLVERA, ELIZABETH BROWN, GINA WILLIAMSON, JUNE CARROLL, LENA JENSEN, LEROY BUSTAMANTE, LORI WOOD, MARGARET MOORE, MARIA MILLER, MIRIAM MCKINNEY, OLGA JIMENEZ, PRISCILLA LOWE"
SATURDAY LAMBS,"ALEX GRESHAM, ARLENE HARVEY, BRADLEY MOTLEY, BRENT HARKINS, BYRON BOX, CALVIN MARTEL, DEBRA NELSON, EDUARDO HIATT, ERIN DUNN, FERNANDO CHURCHILL, GERALDINE PERKINS, GILBERT SLEDGE, GLEN TALBERT, HELEN HARRIS, JEANNE LAWSON, JESSIE BANKS, JIMMIE EGGLESTON, JOHN FARNSWORTH, JOY GEORGE, JUSTIN NGO, KIM CRUZ, MARCUS HIDALGO, MARY SMITH, PAMELA BAKER, RUSSELL BRINSON, SANDRA MARTIN, TRACEY BARRETT, VALERIE BLACK"
SATURN NAME,"ALEX GRESHAM, BRANDON HUEY, FLORENCE WOODS, FREDDIE DUGGAN, HEIDI LARSON, JUNE CARROLL, JUSTIN NGO, KRISTEN CHAVEZ, LUCY WHEELER, RYAN SALISBURY, VERA MCCOY, VERNON CHAPA, VIRGIL WOFFORD"
SAVANNAH TOWN,"ALICIA MILLS, CHERYL MURPHY, CONSTANCE REID, ERNEST STEPP, FRANCISCO SKIDMORE, JAMES GANNON, JEANETTE GREENE, JOHNNY TURPIN, LOIS BUTLER, MARY SMITH, NICOLE PETERSON, VIOLA HANSON"
SCALAWAG DUCK,"ADRIAN CLARY, ASHLEY RICHARDSON, BETH FRANKLIN, BONNIE HUGHES, BRADLEY MOTLEY, CHESTER BENNER, CRAIG MORRELL, DARLENE ROSE, DEAN SAUER, FLORENCE WOODS, GREG ROBINS, GREGORY MAULDIN, GUY BROWNLEE, ISAAC OGLESBY, JACQUELINE LONG, JASON MORRISSEY, JEANETTE GREENE, JOANN GARDNER, JOHN FARNSWORTH, KATHY JAMES, KRISTINA CHAMBERS, KURT EMMONS, LANCE PEMBERTON, LESTER KRAUS, NATHAN RUNYON, PATSY DAVIDSON, RAY HOULE, RITA GRAHAM, RYAN SALISBURY, SHAWN HEATON, SYLVIA ORTIZ, TERRENCE GUNDERSON"
SCARFACE BANG,"ALEXANDER FENNELL, ALVIN DELOACH, ANDRE RAPP, ANTHONY SCHWAB, BETH FRANKLIN, BRUCE SCHWARZ, CAROLE BARNETT, CLINTON BUFORD, ELLA OLIVER, GUY BROWNLEE, JAMES GANNON, JANET PHILLIPS, JUNE CARROLL, MARION OCAMPO, MARSHA DOUGLAS, SHANNON FREEMAN, WARREN SHERROD, WAYNE TRUONG"
SCHOOL JACKET,"BERNICE WILLIS, CARMEN OWENS, ISAAC OGLESBY, JIMMIE EGGLESTON, MARCIA DEAN, WILLIE HOWELL"
SCISSORHANDS SLUMS,"BILLIE HORTON, DONNA THOMPSON, ELEANOR HUNT, JENNIE TERRY, JOSEPH JOY, LAWRENCE LAWTON, MARVIN YEE, RACHEL BARNES, ROBERTA HARPER, ROSEMARY SCHMIDT, SHANNON FREEMAN, STACEY MONTGOMERY, STANLEY SCROGGINS, TRACY HERRMANN, VICKIE BREWER"
SCORPION APOLLO,"ANDRE RAPP, ASHLEY RICHARDSON, BILL GAVIN, CLYDE TOBIAS, CURTIS IRBY, GERALDINE PERKINS, GLENN PULLEN, GWENDOLYN MAY, HEATHER MORRIS, JESSICA HALL, KAREN JACKSON, KEITH RICO, KRISTEN CHAVEZ, KRISTIN JOHNSTON, KYLE SPURLOCK, PAULA BRYANT, RICK MATTOX, SEAN DOUGLASS, THOMAS GRIGSBY, TINA SIMMONS, VANESSA SIMS, VICKI FIELDS, VIOLET RODRIQUEZ"
SEA VIRGIN,"CAROLE BARNETT, CURTIS IRBY, GILBERT SLEDGE, GLENDA FRAZIER, JACQUELINE LONG, JULIA FLORES, JUNE CARROLL, KIRK STCLAIR, LEO EBERT, LESLIE SEWARD, LILLIAN GRIFFIN, MABEL HOLLAND, MARTHA GONZALEZ, MIRIAM MCKINNEY, NANCY THOMAS, NORA HERRERA, PATRICK NEWSOM, REGINALD KINDER, ROBERTO VU, ROGER QUINTANILLA, RYAN SALISBURY, THELMA MURRAY"
SEABISCUIT PUNK,"ALAN KAHN, APRIL BURNS, ARTHUR SIMPKINS, BOBBIE CRAIG, BRETT CORNWELL, CLAYTON BARBEE, DAISY BATES, DANNY ISOM, EILEEN CARR, GEORGE LINTON, GLENN PULLEN, IRMA PEARSON, JESSICA HALL, JESSIE BANKS, KATHLEEN ADAMS, MICHELLE CLARK, MILDRED BAILEY, RENE MCALISTER, RITA GRAHAM, RYAN SALISBURY, SARA PERRY, SCOTT SHELLEY, SHERRY MARSHALL, THEODORE CULP, TRAVIS ESTEP"
SEARCHERS WAIT,"ADAM GOOCH, CLIFTON MALCOLM, CURTIS IRBY, EDWARD BAUGH, GABRIEL HARDER, GORDON ALLARD, HARRY ARCE, JOEL FRANCISCO, JONATHAN SCARBOROUGH, MARCUS HIDALGO, MARGARET MOORE, MARJORIE TUCKER, SAMUEL MARLOW, TERESA ROGERS"
SEATTLE EXPECATIONS,"ALBERTO HENNING, ALLAN CORNISH, BILLIE HORTON, BOBBY BOUDREAU, CASSANDRA WALTERS, DEANNA BYRD, EDDIE TOMLIN, FRANCIS SIKES, FRANKLIN TROUTMAN, FREDERICK ISBELL, JEFF EAST, JENNIFER DAVIS, KATHRYN COLEMAN, KELLY KNOTT, KIRK STCLAIR, LARRY THRASHER, LUCY WHEELER, MARION SNYDER, RON DELUCA, SAM MCDUFFIE, SHEILA WELLS, TERRY CARLSON, VIRGINIA GREEN, WENDY HARRISON"
SECRET GROUNDHOG,"ALICE STEWART, AMBER DIXON, ARTHUR SIMPKINS, AUDREY RAY, BRAD MCCURDY, BRANDY GRAVES, CARLOS COUGHLIN, CHAD CARBONE, CHRISTIAN JUNG, CHRISTINA RAMIREZ, DARLENE ROSE, DENISE KELLY, EARL SHANKS, ELEANOR HUNT, EUGENE CULPEPPER, FERNANDO CHURCHILL, JOHN FARNSWORTH, LEONARD SCHOFIELD, NICOLE PETERSON, SALLY PIERCE, TONYA CHAPMAN"
SECRETARY ROUGE,"ALFRED CASILLAS, ANTHONY SCHWAB, BENJAMIN VARNEY, ELLA OLIVER, HILDA HOPKINS, JACK FOUST, JAMIE WAUGH, JEREMY HURTADO, JESSIE MILAM, JULIA FLORES, LAUREN HUDSON, MICHELE GRANT, NEIL RENNER, NORMA GONZALES, REGINALD KINDER, ROSA REYNOLDS, STACEY MONTGOMERY, ZACHARY HITE"
SECRETS PARADISE,"ALAN KAHN, ALICE STEWART, BEVERLY BROOKS, CAROL GARCIA, CLIFTON MALCOLM, COURTNEY DAY, EDWIN BURK, EILEEN CARR, ELAINE STEVENS, ERIK GUILLEN, GILBERT SLEDGE, HUGH WALDROP, JARED ELY, JESSICA HALL, KATIE ELLIOTT, KAY CALDWELL, KIMBERLY LEE, LESTER KRAUS, MINNIE ROMERO, TERRENCE GUNDERSON"
SENSE GREEK,"CHRISTY VARGAS, JENNY CASTRO, KATIE ELLIOTT, KIM CRUZ, LAURA RODRIGUEZ, SALLY PIERCE, VERNON CHAPA"
SENSIBILITY REAR,"DENNIS GILMAN, DIANE COLLINS, GENE SANBORN, JENNIE TERRY, KATIE ELLIOTT, LEO EBERT, PAUL TROUT, ROSA REYNOLDS, VICTOR BARKLEY, YOLANDA WEAVER"
SEVEN SWARM,"CARL ARTIS, FERNANDO CHURCHILL, FREDDIE DUGGAN, JESSE SCHILLING, JUSTIN NGO"
SHAKESPEARE SADDLE,"BOB PFEIFFER, CRAIG MORRELL, DIANA ALEXANDER, EDNA WEST, ERIC ROBERT, GARY COY, GERALDINE PERKINS, GUY BROWNLEE, HAZEL WARREN, JUAN FRALEY, JULIAN VEST, JUNE CARROLL, LAWRENCE LAWTON, MARILYN ROSS, NICHOLAS BARFIELD, PERRY SWAFFORD, RANDY GAITHER, SHANNON FREEMAN, TED BREAUX, VIOLA HANSON, VIRGINIA GREEN, WALLACE SLONE"
SHANE DARKNESS,"ALFRED CASILLAS, CLYDE TOBIAS, FELICIA SUTTON, FRANKLIN TROUTMAN, GREG ROBINS, HEATHER MORRIS, KEITH RICO, LESLIE GORDON, MIGUEL BETANCOURT, RONNIE RICKETTS, ROY WHITING, SHERRI RHODES, STELLA MORENO, VINCENT RALSTON"
SHANGHAI TYCOON,"ANGELA HERNANDEZ, ANNETTE OLSON, BARBARA JONES, CONSTANCE REID, FRANCIS SIKES, HELEN HARRIS, JEAN BELL, JEREMY HURTADO, JUANITA MASON, MELANIE ARMSTRONG, MONICA HICKS, NATALIE MEYER, STACEY MONTGOMERY, TRACEY BARRETT"
SHAWSHANK BUBBLE,"ALBERTO HENNING, AMY LOPEZ, ASHLEY RICHARDSON, BILLY POULIN, CATHY SPENCER, CHRISTINE ROBERTS, ERIK GUILLEN, FRED WHEAT, GORDON ALLARD, GUY BROWNLEE, JASON MORRISSEY, JUDITH COX, MARJORIE TUCKER, MORRIS MCCARTER, ROSS GREY, SARA PERRY, TERRANCE ROUSH, VIOLA HANSON"
SHEPHERD MIDSUMMER,"ANDREW PURDY, ANN EVANS, BYRON BOX, CLYDE TOBIAS, DEANNA BYRD, DEREK BLAKELY, FRANKLIN TROUTMAN, IRMA PEARSON, JESSIE MILAM, MARSHA DOUGLAS, MILDRED BAILEY, NATHANIEL ADAM, OLGA JIMENEZ, PAULINE HENRY, RICK MATTOX, ROBIN HAYES, RUTH MARTINEZ, SUE PETERS, SUZANNE NICHOLS, TERRI VASQUEZ, TERRY CARLSON, TODD TAN, VERA MCCOY, VERONICA STONE, VIOLET RODRIQUEZ"
SHINING ROSES,"CARMEN OWENS, CATHY SPENCER, GLENN PULLEN, HOWARD FORTNER, LESTER KRAUS, MATTHEW MAHAN, MICHELLE CLARK, TROY QUIGLEY"
SHIP WONDERLAND,"CHRIS BROTHERS, CLAUDIA FULLER, CYNTHIA YOUNG, DARRYL ASHCRAFT, GERALD FULTZ, HECTOR POINDEXTER, JOHN FARNSWORTH, KELLY KNOTT, KRISTINA CHAMBERS, LUCILLE HOLMES, MAURICE CRAWLEY, RAMON CHOATE, SCOTT SHELLEY, TARA RYAN, TERRENCE GUNDERSON"
SHOCK CABIN,"AARON SELBY, ADRIAN CLARY, AGNES BISHOP, ALBERTO HENNING, ALFRED CASILLAS, ANGEL BARCLAY, BILLY POULIN, COLLEEN BURTON, DEBORAH WALKER, DOLORES WAGNER, DONALD MAHON, ETHEL WEBB, FRED WHEAT, HEIDI LARSON, JEREMY HURTADO, JIMMIE EGGLESTON, JOHNNY TURPIN, JUNE CARROLL, LANCE PEMBERTON, MARION OCAMPO, MATHEW BOLIN, MAXINE SILVA, MITCHELL WESTMORELAND, PEARL GARZA, PERRY SWAFFORD, RAFAEL ABNEY, ROSEMARY SCHMIDT, RUTH MARTINEZ, STEPHANIE MITCHELL, TED BREAUX"
SHOOTIST SUPERFLY,"ALFRED CASILLAS, ANNE POWELL, BRAD MCCURDY, CARRIE PORTER, CECIL VINES, CHRIS BROTHERS, CLYDE TOBIAS, FLORENCE WOODS, FRANCES PARKER, HENRY BILLINGSLEY, ISAAC OGLESBY, JENNIFER DAVIS, JENNY CASTRO, JOHNNY TURPIN, JOSEPHINE GOMEZ, LEE HAWKS, MARIO CHEATHAM, MELISSA KING, OSCAR AQUINO, PATRICK NEWSOM, ROBIN HAYES, ROSS GREY, TIM CARY, WILLIE MARKHAM"
SHOW LORD,"ALMA AUSTIN, AMANDA CARTER, ASHLEY RICHARDSON, AUDREY RAY, BRADLEY MOTLEY, BRENDA WRIGHT, CURTIS IRBY, DANA HART, DIANA ALEXANDER, FELICIA SUTTON, GEORGIA JACOBS, HEATHER MORRIS, JEANNE LAWSON, JOAN COOPER, JOYCE EDWARDS, KRISTINA CHAMBERS, LESLIE GORDON, RUSSELL BRINSON, SARA PERRY, SETH HANNON, VALERIE BLACK, VELMA LUCAS, VICTOR BARKLEY, VIVIAN RUIZ, WANDA PATTERSON"
SHREK LICENSE,"BEVERLY BROOKS, CHERYL MURPHY, DANNY ISOM, DONNA THOMPSON, ELSIE KELLEY, FREDERICK ISBELL, GENE SANBORN, JAMES GANNON, KRISTINA CHAMBERS, LILLIE KIM, LLOYD DOWD, PHILLIP HOLM, STEPHANIE MITCHELL, VIVIAN RUIZ, WALLACE SLONE"
SHRUNK DIVINE,"BEN EASTER, CHRISTIAN JUNG, CHRISTINE ROBERTS, EDNA WEST, EDWIN BURK, ETHEL WEBB, FRANCES PARKER, JEANNE LAWSON, JORGE OLIVARES, JUANITA MASON, LESLIE SEWARD, LOIS BUTLER, MATTHEW MAHAN, MICHELLE CLARK"
SIDE ARK,"BRIAN WYMAN, ERIC ROBERT, JASON MORRISSEY, JIM REA, JOANNE ROBERTSON, JORDAN ARCHULETA, MARCUS HIDALGO, MARK RINEHART, NAOMI JENNINGS, RANDALL NEUMANN, ROY WHITING, TAMARA NGUYEN"
SIEGE MADRE,"ADAM GOOCH, ALFRED CASILLAS, APRIL BURNS, COLLEEN BURTON, DARRELL POWER, DARYL LARUE, DONNA THOMPSON, JANET PHILLIPS, JOHN FARNSWORTH, MARCUS HIDALGO, PEDRO CHESTNUT, REGINALD KINDER, SHIRLEY ALLEN, SONIA GREGORY, WILLIE HOWELL"
SIERRA DIVIDE,"BERTHA FERGUSON, BRETT CORNWELL, CAROLE BARNETT, ERIN DUNN, ESTHER CRAWFORD, HECTOR POINDEXTER, JANE BENNETT, LOIS BUTLER, LUCILLE HOLMES, MAE FLETCHER, MARIA MILLER, MEGAN PALMER, PAULA BRYANT, RALPH MADRIGAL, STEVE MACKENZIE"
SILENCE KANE,"ALFRED CASILLAS, BARRY LOVELACE, CARRIE PORTER, CHARLENE ALVAREZ, DONALD MAHON, EDNA WEST, ELLEN SIMPSON, IAN STILL, JAMES GANNON, JEREMY HURTADO, JOHNNIE CHISHOLM, MARJORIE TUCKER, RONNIE RICKETTS, SAMANTHA DUNCAN, TOM MILNER, YOLANDA WEAVER"
SILVERADO GOLDFINGER,"ALEX GRESHAM, ANDY VANHORN, DANA HART, GILBERT SLEDGE, GORDON ALLARD, KURT EMMONS, LANCE PEMBERTON, LORI WOOD, MABEL HOLLAND, STEVE MACKENZIE, TYRONE ASHER, VELMA LUCAS"
SIMON NORTH,"CHAD CARBONE, GLADYS HAMILTON, JEFFERY PINSON, NANCY THOMAS, PENNY NEAL, SHANNON FREEMAN"
SINNERS ATLANTIS,"CAROLYN PEREZ, DAISY BATES, DAVE GARDINER, EDGAR RHOADS, EMMA BOYD, EUGENE CULPEPPER, JAMIE RICE, JENNY CASTRO, JIM REA, KARL SEAL, KIRK STCLAIR, LAURIE LAWRENCE, MARION OCAMPO, MILDRED BAILEY, NEIL RENNER, REGINA BERRY, THELMA MURRAY, THOMAS GRIGSBY, VINCENT RALSTON, WARREN SHERROD, ZACHARY HITE"
SLACKER LIAISONS,"DAVE GARDINER, DIANA ALEXANDER, ELLA OLIVER, EMMA BOYD, GRACE ELLIS, KENT ARSENAULT, MABEL HOLLAND, MARION OCAMPO, MARTHA GONZALEZ, NAOMI JENNINGS, PATSY DAVIDSON, PAULA BRYANT, RENEE LANE, SAMANTHA DUNCAN, STEPHEN QUALLS, WADE DELVALLE"
SLEEPING SUSPECTS,"AARON SELBY, ADAM GOOCH, BEN EASTER, CASSANDRA WALTERS, CONNIE WALLACE, DEAN SAUER, DONALD MAHON, DWIGHT LOMBARDI, JAMIE RICE, JANICE WARD, JESUS MCCARTNEY, LOUIS LEONE, NORMA GONZALES, RAMONA HALE, RHONDA KENNEDY, ROBERT BAUGHMAN, SAMANTHA DUNCAN, SARAH LEWIS, SHANE MILLARD, SONIA GREGORY, SYLVIA ORTIZ, TYRONE ASHER, WILLIE HOWELL, YOLANDA WEAVER"
SLEEPLESS MONSOON,"ALICIA MILLS, BERNARD COLBY, BRENDA WRIGHT, BYRON BOX, JAMIE RICE, JARED ELY, JEREMY HURTADO, JOY GEORGE, LESLIE GORDON, LUCILLE HOLMES, MARTIN BALES, MONICA HICKS, PAUL TROUT, RAMON CHOATE, RENE MCALISTER, RICK MATTOX, ROBERT BAUGHMAN, STACEY MONTGOMERY, TRACY COLE"
SLEEPY JAPANESE,"ALEXANDER FENNELL, BOB PFEIFFER, BRIAN WYMAN, CARMEN OWENS, COREY HAUSER, COURTNEY DAY, DEREK BLAKELY, EVA RAMOS, EVERETT BANDA, FLORENCE WOODS, KRISTEN CHAVEZ, LILLIAN GRIFFIN, MANUEL MURRELL, MARCIA DEAN, MISTY LAMBERT, NEIL RENNER, PAMELA BAKER, PRISCILLA LOWE, RAMON CHOATE, TAMMY SANDERS, WARREN SHERROD"
SLEUTH ORIENT,"ALBERT CROUSE, BRAD MCCURDY, BRANDY GRAVES, CAROLYN PEREZ, DANA HART, EDDIE TOMLIN, EVELYN MORGAN, JEFF EAST, JENNIFER DAVIS, JESSICA HALL, JOHN FARNSWORTH, JOYCE EDWARDS, LORRAINE STEPHENS, MARSHALL THORN, NATHANIEL ADAM, PATSY DAVIDSON, SHANE MILLARD, THELMA MURRAY, VERONICA STONE"
SLING LUKE,"CARRIE PORTER, CHRISTY VARGAS, JANICE WARD, KATHLEEN ADAMS, STEPHEN QUALLS, THERESA WATSON"
SLIPPER FIDELITY,"BOBBIE CRAIG, DAVID ROYAL, EMILY DIAZ, HENRY BILLINGSLEY, JAMIE WAUGH, JOHN FARNSWORTH, KATHRYN COLEMAN, LEONARD SCHOFIELD, MARJORIE TUCKER, MAX PITT, OLGA JIMENEZ, RICHARD MCCRARY, ROLAND SOUTH, STEVEN CURLEY, THELMA MURRAY, THERESA WATSON"
SLUMS DUCK,"ALICIA MILLS, CARMEN OWENS, CINDY FISHER, DARRYL ASHCRAFT, DAVE GARDINER, DAVID ROYAL, DONNA THOMPSON, ELIZABETH BROWN, EVA RAMOS, FELICIA SUTTON, IRMA PEARSON, JACKIE LYNCH, JAY ROBB, JORDAN ARCHULETA, JOSE ANDREW, KARL SEAL, LORI WOOD, MARSHALL THORN, RANDY GAITHER, RENEE LANE, TANYA GILBERT, TERRANCE ROUSH, VICTORIA GIBSON, WILLIE MARKHAM"
SMILE EARRING,"ALICE STEWART, ANNE POWELL, HELEN HARRIS, HERMAN DEVORE, HUGH WALDROP, JOE GILLILAND, NATALIE MEYER, ROSEMARY SCHMIDT, ROSS GREY, VIRGIL WOFFORD"
SMOKING BARBARELLA,"ALMA AUSTIN, ARNOLD HAVENS, BRETT CORNWELL, BYRON BOX, GLADYS HAMILTON, HAZEL WARREN, HEIDI LARSON, HELEN HARRIS, JEFF EAST, JOE GILLILAND, JOSE ANDREW, JUAN FRALEY, KATHRYN COLEMAN, KYLE SPURLOCK, LESLIE SEWARD, LISA ANDERSON, LYDIA BURKE, PEARL GARZA"
SMOOCHY CONTROL,"CHARLES KOWALSKI, GERALD FULTZ, JANE BENNETT, JAVIER ELROD, JILL HAWKINS, JOHNNY TURPIN, KATHERINE RIVERA, RAYMOND MCWHORTER, ROSA REYNOLDS, SAMANTHA DUNCAN, SHARON ROBINSON, THELMA MURRAY"
SNATCH SLIPPER,"ANGEL BARCLAY, AUDREY RAY, BETH FRANKLIN, CHERYL MURPHY, COLLEEN BURTON, DENNIS GILMAN, DUANE TUBBS, JACOB LANCE, JILL HAWKINS, JUNE CARROLL, LAURIE LAWRENCE, LORETTA CARPENTER, MARY SMITH, NATHAN RUNYON, ROSA REYNOLDS, SHELLY WATTS, SONIA GREGORY, TROY QUIGLEY, VELMA LUCAS, VIRGINIA GREEN, WADE DELVALLE"
SNATCHERS MONTEZUMA,"ELEANOR HUNT, GARY COY, GLEN TALBERT, KYLE SPURLOCK, LOUIS LEONE, REBECCA SCOTT, ROSA REYNOLDS, TODD TAN, TYRONE ASHER"
SNOWMAN ROLLERCOASTER,"ALMA AUSTIN, BERNICE WILLIS, BOBBY BOUDREAU, DENISE KELLY, DOROTHY TAYLOR, EUGENE CULPEPPER, FERNANDO CHURCHILL, GREG ROBINS, JEROME KENYON, JOSEPHINE GOMEZ, JOSHUA MARK, JUDITH COX, KATHRYN COLEMAN, LUCILLE HOLMES, MARCIA DEAN, MARCUS HIDALGO, PEGGY MYERS, PHYLLIS FOSTER, RUBY WASHINGTON, SANDRA MARTIN, SARA PERRY, SEAN DOUGLASS, SUZANNE NICHOLS"
SOLDIERS EVOLUTION,"DIANE COLLINS, ELEANOR HUNT, EVELYN MORGAN, GINA WILLIAMSON, LESLIE GORDON, SETH HANNON, THELMA MURRAY, WARREN SHERROD"
SOMETHING DUCK,"AUSTIN CINTRON, CASSANDRA WALTERS, DARRELL POWER, DARYL LARUE, EMMA BOYD, GORDON ALLARD, JACQUELINE LONG, JOE GILLILAND, LAUREN HUDSON, LEON BOSTIC, LILLIE KIM, LOIS BUTLER, MITCHELL WESTMORELAND, NANCY THOMAS, NATHAN RUNYON, NATHANIEL ADAM, RHONDA KENNEDY, TRACY COLE, TRACY HERRMANN"
SONG HEDWIG,"CHARLIE BESS, CHERYL MURPHY, CHRISTIAN JUNG, HEIDI LARSON, JACKIE LYNCH, JENNIE TERRY, JUAN FRALEY, LEO EBERT, PERRY SWAFFORD, RAY HOULE, TAMARA NGUYEN"
SONS INTERVIEW,"CATHY SPENCER, DANIEL CABRAL, GWENDOLYN MAY, JASON MORRISSEY, JILL HAWKINS, JIMMY SCHRADER, LOUIS LEONE, MAE FLETCHER, MONICA HICKS, ROSA REYNOLDS, SARAH LEWIS, TERRI VASQUEZ, WENDY HARRISON, ZACHARY HITE"
SORORITY QUEEN,"CASSANDRA WALTERS, CONSTANCE REID, EMILY DIAZ, GORDON ALLARD, JULIA FLORES, KEN PREWITT, LAURIE LAWRENCE, LEONARD SCHOFIELD, MARJORIE TUCKER, REGINALD KINDER, RUSSELL BRINSON, VIRGIL WOFFORD"
SOUP WISDOM,"BETTY WHITE, BRITTANY RILEY, GAIL KNIGHT, NICHOLAS BARFIELD, ROBERTO VU, THELMA MURRAY, VICTORIA GIBSON, YOLANDA WEAVER"
SOUTH WAIT,"ANITA MORALES, ANN EVANS, CLIFTON MALCOLM, DANIELLE DANIELS, DEAN SAUER, DORIS REED, ELEANOR HUNT, FRANCIS SIKES, GENE SANBORN, HOLLY FOX, JANICE WARD, KAREN JACKSON, KATHY JAMES, KRISTINA CHAMBERS, LARRY THRASHER, LISA ANDERSON, LUCILLE HOLMES, MARC OUTLAW, RON DELUCA, SYLVIA ORTIZ, TARA RYAN, TONYA CHAPMAN"
SPARTACUS CHEAPER,"ANA BRADLEY, DANA HART, JACKIE LYNCH, JOYCE EDWARDS, JULIO NOLAND, NELLIE GARRETT, NORA HERRERA, REGINALD KINDER, RONNIE RICKETTS"
SPEAKEASY DATE,"ALICE STEWART, AMBER DIXON, ANNETTE OLSON, BETH FRANKLIN, DEBRA NELSON, JEFFERY PINSON, MARION OCAMPO, PEARL GARZA, SALVADOR TEEL, STEVE MACKENZIE, TERRI VASQUEZ, WAYNE TRUONG"
